white_id,white_rating,black_id,black_rating,elo_diff,winner,victory_status,turns,moves
giigii,1015,psaki,1563,-548,black,resign,74,e4 c6 d4 d5 exd5 cxd5 Nc3 e6 Bd3 a6 Nf3 Nf6 O-O Bd6 Ne5 Nc6 Ng4 Nxd4 Nxf6+ Qxf6 Re1 Qh4 h3 O-O Be3 Bc5 Na4 Ba7 Be2 Nxe2+ Qxe2 Qxa4 Bxa7 Rxa7 b3 Qh4 Kh2 Bd7 g3 Qh6 f4 Re8 Rac1 b5 Rf1 e5 fxe5 Qxh3+ Kg1 Qxg3+ Qg2 Qxg2+ Kxg2 Rxe5 Rce1 f6 Rxe5 fxe5 Re1 e4 Kg3 Bf5 Kf4 g6 Ke5 Rc7 Rc1 e3 Kxd5 Rxc2 Re1 e2 Rxe2 Rxe2
ranchowangdu,1500,gannet,2047,-547,white,resign,85,c4 c5 Nc3 Nc6 Nf3 g6 d4 cxd4 Nxd4 Bg7 Nc2 Nf6 e4 d6 Be2 O-O Be3 Qa5 O-O Be6 Rc1 Rac8 f3 Ne5 b4 Qc7 Na3 a6 Nd5 Bxd5 cxd5 Qd7 b5 Rxc1 Qxc1 Rc8 Qd2 Qc7 bxa6 bxa6 Rc1 Qxc1+ Qxc1 Rxc1+ Bxc1 Ned7 Bxa6 Nc5 Bb5 Nfd7 Be3 Bc3 Nc4 f5 a4 Bb4 a5 fxe4 fxe4 Nf6 a6 Nxa6 Bxa6 Nxe4 Bc8 Bc5 Bxc5 Nxc5 Kf2 Kf7 Ke3 Kf6 g4 h6 Nb6 Ke5 h4 g5 h5 e6 dxe6 Nxe6 Bxe6 Kxe6 Kd4
ipotekamd,1586,siindbad,2133,-547,black,mate,34,e4 Nf6 e5 Nd5 d4 d6 Bc4 Nb6 Bb3 dxe5 Qf3 e6 dxe5 c5 Bg5 Qxg5 Nc3 Bd7 Ne4 Qxe5 O-O-O c4 Bxc4 Nxc4 Nc3 Qa5 Qxb7 Ba3 Qxa8 Bxb2+ Kb1 Qb4 Ne4 Na3#
silvio_toro,1329,justanotherguy321,1876,-547,white,mate,85,d4 d5 Bf4 e6 Nf3 Nf6 e3 h6 Nbd2 Nc6 a3 g5 Bg3 Bd6 Bb5 Bxg3 Bxc6+ bxc6 hxg3 O-O Ne5 Qd6 c3 Ba6 b3 Nd7 Nxd7 Qxd7 Qh5 Bd3 Qxh6 f6 f3 Qh7 Qxh7+ Bxh7 e4 Rfe8 Rc1 dxe4 Nxe4 Kg7 Kd2 f5 Nxg5 Rh8 Nxe6+ Kg8 Rh6 Re8 Nf4 Kf7 Rch1 Re6 Rxh7+ Rxh7 Rxh7+ Kf6 Nxe6 Kxe6 Rxc7 Kd5 Rxa7 c5 Ra5 Kc6 Rxc5+ Kb6 b4 f4 a4 fxg3 a5+ Ka6 d5 Ka7 d6 Ka6 d7 Ka7 d8=Q Ka6 Qc8+ Ka7 Rc7#
dumb_robot,1219,gjdgjdfj,1765,-546,black,mate,34,e4 c5 Nf3 d6 d3 Nf6 Nc3 g6 Bg5 Bg7 Nd5 O-O Qd2 Na6 Bh6 Nc7 Nxf6+ exf6 h4 Re8 h5 f5 hxg6 fxg6 Bxg7 fxe4 Be2 exf3 gxf3 g5 Qc3 Qe7 Bf6 Qxe2#
iniciante07,826,redevening,1372,-546,black,resign,46,e4 c5 Nf3 Nc6 Bb5 e6 Nc3 Nge7 a3 a6 Bc4 b5 Bd3 Bb7 a4 c4 Be2 d5 axb5 axb5 b3 Rxa1 Nxb5 Qb8 bxc4 Nb4 Bf1 Ra2 exd5 Nxc2+ Ke2 exd5 Nc3 Ra8 Qxc2 dxc4 d3 Bxf3+ gxf3 Qe5+ Kd2 cxd3 Qxd3 Rd8 Nd5 Rxd5
jofranmaster,1585,holyship,2131,-546,white,resign,83,e4 d6 Bc4 Nf6 Nc3 g6 d3 Bg7 Bd2 O-O Nge2 Nbd7 O-O a6 f4 b5 Bb3 c5 a3 Bb7 f5 Ne5 fxg6 hxg6 Bg5 Rc8 Bxf6 Bxf6 Nd5 Bg7 Ng3 c4 dxc4 bxc4 Ba2 e6 Nc3 Qb6+ Kh1 Qxb2 Qb1 Qxc3 Qxb7 Qxc2 Qxa6 Nd3 Qxd6 Rfd8 Qa6 Nf2+ Kg1 Bd4 Rxf2 Qxf2+ Kh1 Be5 Bxc4 Bxg3 hxg3 Qxg3 Rc1 Rd2 Qxc8+ Kg7 Bf1 Qh4+ Kg1 Qf2+ Kh1 Qh4+ Kg1 Qf2+ Kh2 Qh4+ Kg1 Qf4 Qc3+ e5 Qf3 Qh6 Qc3 Rd8 Qxe5+
youredeadmeat,1498,buntownik,2044,-546,black,resign,84,d4 c5 dxc5 e6 Nf3 Bxc5 e4 Nf6 Nbd2 Qb6 Qe2 Ng4 Nc4 Bxf2+ Kd2 Qc5 h3 b5 hxg4 bxc4 a3 Nc6 c3 Bg3 b4 cxb3 Ne1 Bf4+ Kd1 Qxc3 Rb1 Bxc1 Rxc1 Qd4+ Qd3 b2 Qxd4 Nxd4 Rb1 Rb8 Nc2 Nxc2 Kxc2 O-O Rxb2 Rxb2+ Kxb2 Bb7 e5 Bd5 Rg1 f6 Bb5 fxe5 Bxd7 Rf2+ Kb1 Rxg2 Rxg2 Bxg2 Bxe6+ Kf8 Bc4 Bh3 Be2 Ke7 Kc2 Kd6 Kd3 Bg2 Ke3 Kd5 Kf2 Be4 Bf3 Bxf3 Kxf3 e4+ Ke3 Ke5 a4 a5 Kf2 Kf4
fanfan76,1422,thegreatman06,1967,-545,black,resign,50,e4 e5 Bc4 Nf6 Nf3 d6 d3 a6 Ng5 Be6 Nc3 Bxc4 dxc4 h6 Nf3 Nc6 Be3 Qd7 O-O Be7 h3 g5 g4 h5 Bxg5 hxg4 Nh4 gxh3 f4 h2+ Kxh2 Ng4+ Kg3 Ne3 Qf3 Nxf1+ Rxf1 O-O-O Rd1 Bxg5 fxg5 Rxh4 Kxh4 Rh8+ Kg3 Rh3+ Kg2 Rxf3 Kxf3 Nd4+
chees29,1173,sunilsb,1718,-545,black,mate,64,e4 e6 d4 d5 c3 dxe4 Nd2 Be7 Nxe4 f5 Bg5 fxe4 Bxe7 Qxe7 d5 exd5 Qxd5 Nf6 Qd4 O-O O-O-O Be6 Qb4 Qxb4 cxb4 Bxa2 f3 e3 Nh3 Nc6 Bd3 Nxb4 Be4 Nxe4 fxe4 e2 Rde1 Nd3+ Kd2 Nxe1 Kxe1 Bc4 e5 Rf1+ Rxf1 exf1=Q+ Kd2 Qxg2+ Kc3 Qxh3+ Kxc4 c6 Kc5 Qxh2 Kd6 Qd2+ Kc7 Qxb2 e6 Qb6+ Kd6 Rd8+ Ke7 Qc7#
rock_the_roll,1420,pink-flower,1964,-544,black,mate,40,e4 e5 Nf3 Nc6 Bc4 Bc5 O-O Nf6 Ng5 O-O Bxf7+ Rxf7 Nxf7 Kxf7 d3 h6 Be3 Bb6 Bxb6 axb6 Qc1 d6 f3 Kg8 g4 Qe8 g5 Qg6 h4 Nh5 Nc3 Nf4 Nd5 hxg5 hxg5 Qxg5+ Kf2 Qg2+ Ke3 Qe2#
madd_hatter,1517,jenny_1998,2061,-544,black,mate,50,e4 c5 Nf3 d6 Nc3 Nf6 d4 cxd4 Nxd4 a6 Bd3 e6 Nb3 Nc6 a3 Be7 Qe2 O-O f3 b5 Be3 Bb7 O-O-O Qc7 Kb1 Ne5 Bc1 Rfc8 Qd2 Nxd3 Qxd3 Nd7 Rhe1 Ne5 Qd2 Nc4 Qe2 Bf6 Rd3 Nxa3+ bxa3 Bxc3 Red1 d5 exd5 Bxd5 Qe3 Bf6 Rxd5 Qxc2#
raposaakatsuki,1543,wellsaid,2087,-544,black,mate,52,d3 d5 g3 e5 Bg2 Nf6 Nc3 Bb4 a3 Ba5 b4 Bb6 e3 O-O Nf3 Qd6 O-O Nc6 Bb2 a6 d4 exd4 exd4 Re8 Na4 Ba7 Re1 Rxe1+ Qxe1 Bf5 Rd1 Bxc2 Rd2 Bxa4 Qe3 Re8 Qd3 Ne4 Ng5 Nxg5 Re2 Rxe2 Qxe2 Nxd4 Bxd4 Bxd4 Bxd5 Qxd5 h4 Bc6 Kf1 Qh1#
chicago_chess,1333,hcm10,1876,-543,black,mate,76,e4 c5 Nf3 Nc6 Nc3 e6 d4 cxd4 Nxd4 d6 Bb5 Qc7 O-O Nf6 Bg5 Be7 Bxf6 Bxf6 Na4 O-O c3 Nxd4 cxd4 Qa5 Qb3 a6 Nc3 axb5 Nxb5 Be7 Rac1 Qxa2 Qb4 Ra4 Nc3 Rxb4 Nxa2 Rxb2 Rc4 b5 Rc3 Bb7 Nc1 Bxe4 Nd3 Rd2 Rfc1 Rxd3 Rc8 Rxd4 f3 Bb7 R8c7 Bg5 R1c2 Bd5 Rc8 f5 Rxf8+ Kxf8 Rc8+ Kf7 Rc7+ Kg6 Rc2 Be3+ Kf1 Bc4+ Ke1 Rd3 Ke2 Ra3+ Kd1 Ra1+ Rc1 Rxc1#
drakon1,867,chiggen,1410,-543,black,resign,2,e3 e6
jarrydlee,1128,miscellaneous,1670,-542,black,mate,48,e4 d5 Bb5+ c6 Bxc6+ bxc6 exd5 Qxd5 Nc3 Qxg2 Nf3 Qxh1+ Ng1 Qxg1+ Ke2 Qxd1+ Kxd1 Bg4+ Ne2 Bxe2+ Kxe2 e5 Ke3 Nd7 Ke4 Bd6 b3 Ngf6+ Kf5 O-O Bb2 g6+ Kg5 Ne4+ Kh6 Nxd2 c4 Ne4 c5 Ndxc5 b4 Nd3 Bxe5 Bxe5 b5 Bxa1 bxc6 Bg7#
willoh101,1411,willoh,1953,-542,black,mate,34,e4 e5 d4 exd4 Qxd4 Nc6 Qc4 Nf6 Bf4 d5 exd5 Nxd5 g3 Bf5 Nd2 Qe7+ Ne2 Ncb4 Nb3 Nxc2+ Kd2 Nxa1 Qxd5 Rd8 Ned4 Rxd5 Bc4 Nxb3+ Bxb3 Rxd4+ Kc3 Qc5+ Bc4 Qxc4#
dan00b,1061,redwood,1602,-541,black,resign,44,e4 e5 Nf3 Nc6 Bb5 a6 Bxc6 dxc6 Nxe5 Qd4 Qh5 Nf6 Qg5 Nxe4 Qf4 Bd6 d3 Bxe5 Qxe4 Qxe4+ dxe4 f5 f3 fxe4 fxe4 h6 Nc3 Bxc3+ bxc3 O-O Rhf1 Rxf1+ Kxf1 Be6 Bf4 Rc8 a4 Rf8 g3 Bc4+ Ke1 g5 Bxc7 Rf1+
dumb_robot,1226,gjdgjdfj,1767,-541,white,resign,81,e4 c5 Nf3 d6 Bb5+ Bd7 Bxd7+ Qxd7 O-O Nc6 c3 Nf6 Re1 g6 d4 cxd4 Nxd4 Bg7 Nxc6 bxc6 Na3 O-O Nc4 Nh5 Bg5 h6 Bh4 Rab8 e5 d5 e6 fxe6 Ne5 Bxe5 Rxe5 Rf5 Re2 Rf4 g3 Rf7 Qd3 Kg7 b3 g5 g4 Nf4 Qd4+ Kh7 Re5 gxh4 g5 Ng6 Qd3 hxg5 Rxg5 Rf5 Rg4 Ne5 Rxh4+ Kg7 Qg3+ Kf6 Rh6+ Kf7 Rh7+ Ke8 f4 Kd8 fxe5 Kc7 Qe3 Kb7 Qd4 Qe8 Qb4+ Kc8 Qxe7 Qg6+ Kh1 Rf2 Rh8+
nigelnaomi,1263,tengrihan,1803,-540,white,resign,59,e4 d5 exd5 Qxd5 Nf3 Bg4 Be2 Nc6 O-O O-O-O Nc3 Qa5 d3 e6 Bd2 Qh5 h3 Bxf3 Bxf3 Qh4 Bxc6 bxc6 Qf3 Bd6 Rae1 Nh6 Re4 Qf6 Qxf6 gxf6 Bxh6 Rdg8 Ra4 Rg6 Be3 Rhg8 g3 h5 Ne4 h4 Nxd6+ cxd6 Rxh4 f5 Ra4 e5 Kh2 f4 gxf4 Rg2+ Kh1 exf4 Bxf4 R2g6 Rxa7 Kb8 Rxf7 Rh8 Kh2
chess_king3,1474,fyodord,2014,-540,black,mate,46,c4 e5 g3 Nf6 Bg2 Nc6 Nc3 Bc5 Nf3 O-O b3 d6 d3 Bg4 Bb2 Bb4 O-O Bxc3 Bxc3 Qe7 e4 Rad8 a3 Rd7 b4 Nd8 Qa4 a6 Nd2 Be2 Rfe1 Bh5 Nb3 Ne6 Bh3 Rdd8 Bxe6 fxe6 c5 Qf7 h3 Nxe4 dxe4 Qxf2+ Kh1 Bf3#
jcell,886,aran09,1426,-540,black,resign,30,e4 e5 Nc3 Nc6 d3 Nf6 Nh3 Bc5 Nd5 O-O a3 Ng4 Qxg4 g6 c4 h5 Qg5 Be7 Nf6+ Bxf6 Qh6 Nd4 Bg5 Nc2+ Kd2 Nxa1 g4 hxg4 Ng1 Bxg5+
dudewtfman,1224,icecreamdealer,1763,-539,black,mate,32,e4 e5 Bc4 c6 Bxf7+ Kxf7 Qf3+ Qf6 Qb3+ Ke8 Nf3 Ne7 O-O d5 Nc3 b6 Na4 Be6 Qe3 dxe4 Qxe4 Bd5 Qe2 Bxf3 gxf3 Nf5 Nc3 Nh4 b3 Qg6+ Kh1 Qg2#
vasshha,1174,pmw97,1712,-538,black,mate,32,e4 c5 c3 d6 d4 cxd4 cxd4 g6 Nc3 Bg7 d5 Nf6 Bb5+ Bd7 Bxd7+ Nbxd7 Bg5 O-O Qa4 Qb6 O-O-O Rac8 Nf3 Nxe4 Rhe1 Nxc3 bxc3 Rxc3+ Kd2 Qb2+ Qc2 Qxc2#
smartguy101,1057,lgonzaguille,1595,-538,draw,draw,150,d4 d5 e3 Nf6 Nc3 c6 Nf3 Bg4 Be2 Bxf3 Bxf3 e6 O-O Bb4 Bd2 Bxc3 Bxc3 Ne4 Bxe4 dxe4 h3 f5 Kh2 Qc7+ g3 O-O f4 g6 g4 Nd7 gxf5 exf5 Qd2 Nf6 Rae1 Nd5 Ba5 b6 b4 bxa5 bxa5 a6 c4 Ne7 d5 c5 d6 Qc6 dxe7 Rfe8 Qd5+ Qxd5 cxd5 Rxe7 d6 Rd7 Rd1 Rad8 Rg1 Rxd6 Rxd6 Rxd6 Rg5 Rd3 Kg3 Rxe3+ Kf2 Ra3 h4 Rxa2+ Kg3 Ra3+ Kf2 e3+ Kg3 e2+ Kf2 Ra2 Ke1 c4 h5 Kf7 hxg6+ hxg6 Rg2 c3 Rxe2 Rxe2+ Kxe2 c2 Kd2 c1=Q+ Kxc1 Ke6 Kd2 Kd5 Ke3 Kc5 Kf3 Kb5 Kg3 Kxa5 Kh4 Kb4 Kg5 a5 Kxg6 a4 Kxf5 a3 Kg5 a2 f5 a1=Q f6 Qc1+ Kg6 Qg1+ Kf5 Qf2+ Kg6 Qg3+ Kf5 Qf3+ Ke6 Qf4 f7 Qg4+ Ke7 Qg5+ Ke8 Qe5+ Kf8 Qd6+ Kg7 Qe5+ Kg8 Qg5+ Kf8 Qc5+ Kg7 Qg5+ Kf8 Qh6+ Ke7 Qg5+ Kf8 Qh6+ Ke7 Qg5+
kryptik,1503,abidara,2041,-538,black,resign,53,e4 e6 Nf3 d5 d4 dxe4 Ne5 Bd6 Bf4 Nf6 Nc3 a6 f3 exf3 Qxf3 Nbd7 Nxf7 Kxf7 O-O-O Rf8 Be5 Kg8 Bd3 Qe7 Rhf1 Bxe5 dxe5 Nxe5 Qe3 Nxd3+ Rxd3 Bd7 h3 Bc6 Rf2 Rad8 Rxd8 Rxd8 a3 e5 Rf5 e4 g4 Nd5 Nxd5 Rxd5 Rxd5 Bxd5 Qa7 e3 Qb8+ Kf7 g5
dumb_robot,1228,gjdgjdfj,1766,-538,black,resign,59,e4 c5 Nf3 d6 Bc4 Nf6 Ng5 e6 O-O Be7 d3 Nc6 Bb5 Bd7 Nc3 a6 Bxc6 Bxc6 Qf3 b5 Ne2 O-O Ng3 Nd7 Nxh7 Kxh7 Qh5+ Kg8 f4 Nf6 Qh4 Nxe4 Qg4 Nxg3 Qxg3 Re8 f5 exf5 Bh6 Bf8 Rxf5 Ra7 Rg5 f6 Rg6 Kh7 Qh4 Kxg6 Be3 Rxe3 Qg4+ Kf7 Qh5+ Kg8 Rf1 Be8 Qf5 Re5 Qf3
stellanova,1162,nazmaaziza,1699,-537,black,mate,52,e4 e5 Bc4 Nf6 Nf3 Nc6 Nc3 h6 d4 exd4 Nxd4 Ne5 O-O Nxc4 Re1 d6 e5 Nxe5 Nf5 Bxf5 a4 Be7 Be3 O-O f4 Neg4 h3 Nxe3 Rxe3 Re8 Ra3 Bf8 Qe1 Rxe3 Qxe3 Qd7 Nb5 Re8 Qxa7 Re1+ Kf2 Qe7 Qa8 Qe2+ Kg3 Ne4+ Kh4 Qxg2 Rd3 g5+ Kh5 Bg6#
karabas,1640,smilsydov,2177,-537,black,resign,62,e4 e6 d4 d5 e5 c5 c3 Nc6 Nf3 Bd7 a3 c4 Be3 Nh6 b4 Nf5 Be2 Nxe3 fxe3 Be7 O-O O-O a4 a6 Qc2 f6 e4 fxe5 dxe5 Qc7 Nbd2 Nxe5 Nxe5 Qxe5 Bf3 Bf6 Ra3 a5 b5 Be7 Raa1 Bd6 g3 Rae8 Rae1 Qg5 Rf2 Bc5 Rf1 Rf7 e5 b6 Kg2 Bxf2 Rxf2 Qxe5 Re2 Qd6 Nb1 e5 Bh5 g6
zaeemalam,1500,jameleddine,2037,-537,white,resign,12,e4 d5 exd5 e6 d4 exd5 Nc3 Bf5 Bf4 Nc6 Nf3 Nf6
thefrenchtactics,1365,purifier,1902,-537,black,resign,46,e4 e5 Bc4 Nc6 Nf3 h6 O-O Bc5 b4 Bxb4 c3 Bc5 d4 exd4 cxd4 Bb4 d5 Na5 Be2 d6 a3 Bc5 Nc3 c6 dxc6 Nxc6 Nd5 Nf6 Bb5 Bd7 a4 a5 Bf4 Bg4 Bxc6+ bxc6 Nxf6+ Qxf6 Bxd6 Qxd6 e5 Qxd1 Raxd1 Bxf3 Rd3 Be2
greenmachine,963,chris5150,1500,-537,black,resign,36,d4 d6 e4 Be6 Nf3 Nc6 Nc3 Nf6 Bc4 Bxc4 Bf4 a5 b3 Be6 a4 Ra6 Bg3 Nb4 O-O Rc6 e5 dxe5 dxe5 Nd7 Qe2 Rxc3 Rfd1 Rxc2 Qd2 Rxd2 Rxd2 Bxb3 Rad1 Bxd1 Rxd7 Qxd7
coco31,1142,fischerdipper,1679,-537,black,resign,64,e3 d5 d4 e6 Qe2 Nf6 Nc3 Nc6 f3 a6 Bd2 Bd6 e4 dxe4 fxe4 Nxd4 Qe3 Nxc2+ Kf2 Nxe3 Bxe3 Ng4+ Kf3 Nxe3 Kxe3 Qg5+ Kd3 O-O h4 Qf6 Nge2 Rd8 Nd5 exd5 exd5 Qxb2 Rc1 Bf5+ Kc4 Qb5+ Kd4 c5+ Ke3 Qd3+ Kf2 Re8 Ng3 Qd2+ Be2 Bxg3+ Kxg3 Qxe2 Rhe1 Qg4+ Kh2 Be4 Rc2 Qxh4+ Kg1 Qxe1+ Kh2 Bxc2 g3 Re2+
dazkins,1475,wishiwasbetter,2012,-537,black,mate,44,e4 Nc6 Nf3 e5 d4 exd4 Nxd4 Bc5 Be3 Qf6 c3 Nge7 a3 a5 b4 axb4 axb4 Rxa1 bxc5 O-O Qc2 d5 Bd3 dxe4 Bxe4 Re8 O-O Ng6 Nd2 Rxf1+ Kxf1 Nce5 Qb3 Ng4 Bxb7 Nxe3+ Ke2 Bxb7 Qxb7 Nc4+ Kf1 Nxd2+ Kg1 Re1#
chita,1289,duchess_of_prawns,1825,-536,black,resign,46,d4 d5 Nf3 e6 Bf4 Nc6 e3 h6 Bb5 Bd7 Ne5 Nxe5 Bxd7+ Nxd7 O-O Ngf6 Be5 Ne4 f3 Ng5 Nc3 a6 f4 Nh7 Qd3 f6 Qg6+ Ke7 Bxf6+ Nhxf6 f5 h5 fxe6 Rh6 Qf5 Nb6 h3 Nc4 Rab1 Nxe3 Nxd5+ Qxd5 Qxd5 Nfxd5 Rf3 Rxe6
chess_king3,1474,gatos9999,2010,-536,draw,draw,90,e4 Nc6 d4 d5 e5 Bf5 Nc3 e6 g4 Be4 Nxe4 dxe4 Bg2 Qxd4 Qxd4 Nxd4 Bxe4 c6 a4 O-O-O Be3 c5 a5 f6 c3 Nb5 Nf3 Ne7 exf6 gxf6 a6 b6 g5 Nd6 gxf6 Nxe4 fxe7 Bxe7 Ne5 Bh4 Nf7 Bxf2+ Bxf2 Rdf8 Nxh8 Nxf2 Rf1 Nd3+ Ke2 Nf4+ Kd2 e5 Rae1 Rxh8 Rxe5 Ng6 Rh5 Rd8+ Kc2 Rd7 c4 Re7 Rd5 Re2+ Rd2 Re7 Rfd1 Nf4 Rd8+ Kc7 Ra8 Kc6 Rdd8 Re2+ Kb3 Ne6 Re8 Nd4+ Ka4 Rxb2 Rac8+ Kd7 Rcd8+ Kc7 Rc8+ Kd7 Red8+ Ke7 Re8+ Kd7
simon44,1066,klexus,1602,-536,black,mate,114,e4 e5 b3 Nc6 Ba3 Nf6 Bxf8 Kxf8 Nc3 d6 Qf3 g6 O-O-O Bg4 Qg3 Bxd1 Kxd1 Kg7 Nd5 Nxd5 exd5 Nd4 c3 Nf5 Qd3 Re8 g4 Ne7 h4 c6 h5 Nxd5 h6+ Kg8 c4 Nb4 Qf3 Nxa2 Bd3 Qe7 g5 e4 Bxe4 Qxe4 Qxe4 Rxe4 Ne2 Rae8 Ng3 R4e7 Kc2 Nb4+ Kb2 Nd3+ Ka3 a6 f4 Nxf4 Nh5 Nxh5 d4 Nf4 c5 dxc5 dxc5 Re5 b4 Rxg5 Ka4 Re4 Rd1 Re8 Ka5 Rg3 Kb6 Rb8 Ka7 Re8 Kxb7 Nd5 Kxc6 Rg5 Kb7 Nxb4 c6 Nxc6 Kxc6 Rh5 Rh1 Rxh1 Kc7 f5 Kd7 Kf8 Kc6 Rd1 Kb7 Rd6 Kc7 Red8 Kb7 R8d7+ Kc8 Ke8 Kb8 Rd1 Kc8 R7d2 Kc7 Rc1+ Kb7 Rb2+ Kxa6 Ra1#
zaeemalam,1500,zugaddict,2035,-535,black,resign,108,e4 c5 Nf3 Nc6 d4 cxd4 Nxd4 Nf6 Nc3 e5 Ndb5 d6 Bg5 a6 Na3 Be7 Bxf6 gxf6 g3 f5 Bg2 h5 h4 f4 Bf3 fxg3 fxg3 Rg8 Rg1 Bxh4 Ne2 Bg5 Bxh5 Be3 Rf1 Be6 Qd3 Qg5 Bf3 Nd4 c3 Nxe2 Kxe2 Bc5 Nc2 Qxg3 a3 Qh2+ Ke1 Qh4+ Kd2 Qh2+ Ke1 Rg1 Rxg1 Qxg1+ Kd2 Qf2+ Kc1 O-O-O Kb1 Bb3 c4 Bxc2+ Qxc2 Qxf3 Ka2 Bd4 Rd1 Rg8 Qd3 Qxd3 Rxd3 Rg2 Rb3 Re2 Kb1 Rxe4 Rf3 Rf4 Rxf4 exf4 Kc2 f3 Kd1 Bxb2 Kd2 Bxa3 Ke3 Bc5+ Kxf3 a5 Ke2 a4 Kd2 a3 Kc2 f5 Kb1 f4 Kc2 f3 Kd1 a2 Kd2 a1=Q Kd3 Qd1+
chasesims,1272,lacobriga,1807,-535,black,mate,52,Nc3 e5 Nf3 Nc6 g3 Bc5 Bh3 Nf6 a4 a6 Ra3 Bxa3 bxa3 d6 Bb2 Bxh3 Nb5 axb5 axb5 Ne7 Qa1 Bg2 Rg1 Bxf3 exf3 Ng6 a4 O-O Rf1 c6 bxc6 bxc6 a5 Rxa5 Qb1 Rb5 Kd1 Qb6 h3 Rxb2 Qa1 Rb1+ Qxb1 Qxb1+ Ke2 Qxc2 Ke1 Ra8 f4 Ra2 f3 Qxd2#
mrra,1258,great-mate-super-gre,1793,-535,black,mate,104,e4 c5 Nh3 Nc6 Bd3 e6 O-O Nf6 Nc3 d5 b3 Be7 Bb5 Bd7 Bxc6 Bxc6 Rfe1 O-O d3 Bd6 Bg5 h6 Bxf6 Qxf6 Na4 Qe5 g3 Qf6 exd5 exd5 c3 b5 Nb2 Qxc3 Qe2 Rfe8 Qf1 Rxe1 Rxe1 Qxb2 Re2 Qf6 Qe1 Qf5 Nf4 Bxf4 gxf4 Qxd3 Re3 Qg6+ Rg3 Qf6 Qc1 Qd4 a3 c4 f5 Rc8 bxc4 Qxc4 Qa1 f6 f3 Kf7 Rg4 Qd3 Rf4 Re8 Kg2 Re2+ Kg3 g5 Rb4 Qxf5 Rb2 Rxb2 Qxb2 d4 Kf2 Qxf3+ Ke1 Qc3+ Qxc3 dxc3 Kd1 h5 Kc2 g4 Kxc3 h4 Kd2 g3 hxg3 h3 Kd3 h2 Kd4 h1=Q Kc5 Qd5+ Kb4 Qc4+ Ka5 Qa4#
zeppo,1596,brahim333,2131,-535,black,resign,46,d4 e6 c4 Nf6 Nc3 Bb4 Bd2 c5 dxc5 O-O Nf3 Na6 e3 Nxc5 a3 Bxc3 Bxc3 d6 Bd3 b6 O-O Nfe4 Bxe4 Nxe4 Rc1 Bb7 Qc2 Rc8 b3 Nxc3 Qxc3 Bxf3 gxf3 Qg5+ Kh1 Qh5 f4 Qf3+ Kg1 f5 e4 Qxf4 Qg3 fxe4 Rcd1 Rcd8
mrra,1258,great-mate-super-gre,1793,-535,black,mate,104,e4 c5 Nh3 Nc6 Bd3 e6 O-O Nf6 Nc3 d5 b3 Be7 Bb5 Bd7 Bxc6 Bxc6 Rfe1 O-O d3 Bd6 Bg5 h6 Bxf6 Qxf6 Na4 Qe5 g3 Qf6 exd5 exd5 c3 b5 Nb2 Qxc3 Qe2 Rfe8 Qf1 Rxe1 Rxe1 Qxb2 Re2 Qf6 Qe1 Qf5 Nf4 Bxf4 gxf4 Qxd3 Re3 Qg6+ Rg3 Qf6 Qc1 Qd4 a3 c4 f5 Rc8 bxc4 Qxc4 Qa1 f6 f3 Kf7 Rg4 Qd3 Rf4 Re8 Kg2 Re2+ Kg3 g5 Rb4 Qxf5 Rb2 Rxb2 Qxb2 d4 Kf2 Qxf3+ Ke1 Qc3+ Qxc3 dxc3 Kd1 h5 Kc2 g4 Kxc3 h4 Kd2 g3 hxg3 h3 Kd3 h2 Kd4 h1=Q Kc5 Qd5+ Kb4 Qc4+ Ka5 Qa4#
nitsua49,1649,badrlamal,2183,-534,black,resign,42,e4 c5 Nf3 Nc6 d4 cxd4 Nxd4 Qc7 Nxc6 bxc6 Nc3 e6 Bd3 a6 O-O d5 Re1 Be7 e5 c5 Bf4 c4 Be2 Bc5 Na4 Ba7 b4 Ne7 Bf3 c3 Be3 Bxe3 Rxe3 Nf5 Rxc3 Qb8 Nc5 O-O a3 Qxe5 Qe2 Qxc3
misfox,1101,jpadron19,1635,-534,black,mate,62,e4 e5 Ne2 Nf6 g3 Bc5 Bh3 d6 O-O Bxh3 Re1 O-O c4 Nxe4 b3 Bxf2+ Kh1 Bxe1 Qxe1 Nf6 Bb2 Nc6 d3 Bg4 Nd2 h6 Qf1 Nb4 h3 Bh5 g4 Bg6 Bc3 Nxd3 Qf3 e4 Qe3 Nc5 Bxf6 Qxf6 b4 Qxa1+ Kg2 Ne6 Qxa7 Rxa7 Nxe4 Bxe4+ Kf2 Qxa2 Ke3 Qxc4 Nd4 Qxd4+ Ke2 Re8 Kf1 Qb2 Ke1 Ng5 Kd1 Bf3#
cheflodi,1293,loukas435,1827,-534,black,mate,44,e3 f5 Qf3 g6 Bc4 Nf6 g4 Nxg4 Qd5 e6 Qf3 Ne5 Qe2 Nbc6 d4 Nxc4 Qxc4 Bg7 Nh3 O-O Rg1 Kh8 d5 Ne5 Qc3 Nf3+ Ke2 Nxg1+ Kf1 Bxc3 bxc3 Nxh3 Bb2 Qf6 dxe6 dxe6 Na3 f4 exf4 Qxf4 c4+ Kg8 Re1 Qxf2#
bleda,1297,nik319,1830,-533,black,mate,76,e3 Nf6 f3 g6 Be2 Bg7 c3 O-O Na3 d6 Bd3 a6 b4 b5 Ne2 c5 bxc5 dxc5 Bc2 Be6 Bb3 Bxb3 axb3 b4 Nc4 Nc6 Qc2 a5 O-O bxc3 Nxc3 Nb4 Qb1 Nfd5 Nxd5 Bxa1 Qxa1 Nxd5 Qe5 f6 Qe6+ Kg7 Nb6 Nxb6 Qc6 Rc8 Qb5 Nd5 e4 Nb4 Ba3 Nd3 g3 Qd4+ Kh1 Nf2+ Kg2 Nd3 Kh3 Rb8 Qxa5 Ra8 Qc7 Rxa3 Rb1 Rf7 Qc6 Ne5 Qb5 Nxf3 Rf1 Ng5+ Kg2 Qxe4+ Kf2 Nh3#
isidore,1527,vanitasmarilyn,2060,-533,black,mate,30,e4 e6 d4 d5 Nc3 c5 Be3 Nc6 Nge2 Qb6 Rb1 cxd4 Nxd4 Nxd4 Bxd4 Qb4 Bd3 Bc5 Bxg7 dxe4 Bxe4 f5 Bd3 Qf4 O-O Nf6 Bxh8 Ng4 Qe2 Qxh2#
thebestofthebad,842,projetoxadrez,1374,-532,black,resign,2,d4 h5
alberto1983,1342,mburch1974,1874,-532,black,mate,62,e3 Nc6 c3 d5 Nf3 Nf6 d3 e5 d4 exd4 exd4 Ne4 Be2 Bd6 O-O h5 g3 h4 Ng5 hxg3 fxg3 Nxg5 Bh5 g6 Bf3 Nh3+ Kg2 Be6 b4 Qd7 Na3 O-O-O Nb5 a6 Nxd6+ Qxd6 Bg4 Ne7 Qe2 Rde8 b5 a5 Rf6 Ng8 Bxe6+ Kb8 Qg4 Nxf6 Bf4 Nxf4+ Qxf4 Qxe6 Rb1 Rh5 b6 Qe2+ Qf2 Rxh2+ Kxh2 Qxf2+ Kh3 Rh8#
relentlessstriker,1120,cameronl86,1652,-532,black,resign,47,Nc3 d5 d4 Bf5 e4 Bxe4 Bb5+ c6 Bc4 Bxg2 Bxd5 cxd5 Nxd5 Bxh1 Qd3 Qxd5 Qb3 Qxb3 axb3 Nf6 Bf4 e6 Bxb8 Rxb8 Nh3 Bd6 Ng5 O-O Rxa7 Bxh2 Nh3 Ra8 Ra4 Rxa4 bxa4 Bd5 b4 b5 axb5 Rb8 Ng5 Rxb5 c4 Bxc4 Nf3 Rxb4 Nd2
samuelpro,1002,peachunited,1534,-532,white,mate,13,e4 e5 Bc4 Nc6 Qf3 f6 Qh5+ g6 Qf3 Nge7 Qxf6 Rg8 Qf7#
denisgodunov,1569,snatchpato,2101,-532,black,resign,79,e4 c5 Nf3 Nc6 c3 d5 exd5 Qxd5 Be2 Nf6 O-O e5 Re1 Bd6 b3 O-O Bc4 Qxf3 Qxf3 e4 Qe2 Bg4 Qf1 Ne5 Be2 Bf5 h3 Nd5 c4 Nb4 Na3 a6 Bb2 Ned3 Bxd3 Nxd3 Reb1 Bf4 Qd1 Rad8 Bc3 Rfe8 Qh5 Bg6 Qg4 f5 Qe2 Bg5 Nc2 b5 Ne3 b4 Bb2 f4 Nd5 Bf7 Qh5 Bxh5 g4 fxg3 fxg3 Bf7 Nc7 Re7 Nxa6 Nxb2 Rxb2 Bf6 Rab1 Bd4+ Kf1 Bg6 Rc2 e3 dxe3 Bxc2 Rc1 Bd3+ Ke1
crazyscientist1,884,avestruz,1415,-531,white,resign,57,e4 f5 exf5 Nh6 Qh5+ Nf7 Bc4 d5 Be2 Nd7 Nc3 Nf6 Qf3 Ne5 Qe3 Nc6 d4 Bxf5 Bd3 Ne4 Nxe4 dxe4 Bxe4 Qd7 Bxc6 Qxc6 c3 Qxg2 Qf3 Qxf3 Nxf3 O-O-O Ke2 g6 Ne5 Be6 Bg5 Bg7 Bxe7 Bxe5 Bxd8 Re8 dxe5 Bd5 Rhd1 Rxe5+ Kf1 Bf3 Re1 Rd5 Bh4 Rd2 Re8+ Kd7 Rd8+ Kc6 Rxd2
chippy,1212,gecko_cba,1743,-531,black,resign,16,e4 e5 Nf3 Nc6 Bc4 Be7 Nc3 d6 d4 Bg4 dxe5 Nxe5 Bf4 Bxf3 Qxf3 Nxc4
kicblo37,1502,xstorm59,2033,-531,black,resign,27,d4 Nf6 e3 g6 c4 Bg7 Nc3 O-O Bd3 d5 Nge2 c5 dxc5 Qa5 O-O Qxc5 cxd5 Nxd5 Nxd5 Qxd5 e4 Qh5 Ng3 Qxd1 Rxd1 Nc6 b4
mtnmcallister,2040,teatime007,2571,-531,black,resign,92,e4 c6 Nc3 d5 Nf3 Bg4 h3 Bh5 g4 Bg6 exd5 cxd5 Bb5+ Nc6 d4 e6 Ne5 Rc8 Nxg6 hxg6 Bf4 Bb4 Qd3 Ne7 a3 Bd6 Ne2 Bxf4 Nxf4 Qd6 Qe3 a6 Bd3 Nxd4 Nxg6 Nxg6 Qxd4 e5 Qe3 Nf4 O-O-O O-O h4 Rc6 h5 Rfc8 Rd2 Qc5 Qxc5 Rxc5 Bf5 R8c7 g5 e4 g6 Rb5 Kb1 Re7 Rh4 Ne6 gxf7+ Kxf7 Bg6+ Kf6 Rh3 Nf4 Rg3 Re5 b3 Rc5 Rd1 Nxh5 Bxh5 Rxh5 Rdg1 g5 Kb2 d4 b4 Rf5 Rg4 Rf4 Rxf4+ gxf4 Rg8 e3 Rf8+ Kg5 fxe3 dxe3 Rg8+ Kh4
mimirilinguis,971,shiyasph,1500,-529,black,mate,52,e4 d5 Bb5+ c6 Bd3 dxe4 Bxe4 Nf6 Bd3 e5 f3 Na6 Bxa6 bxa6 g3 e4 fxe4 Nxe4 Qe2 Qe7 d3 Nf6 Qxe7+ Bxe7 Bg5 O-O Bxf6 Bxf6 c3 Rb8 b4 Bf5 Nd2 Bxd3 a3 Rfe8+ Kd1 Rbd8 Ngf3 Be4 Kc1 Bxf3 Nxf3 Re3 Rf1 Rxc3+ Kb2 Rxf3+ Ka2 Rd2+ Kb1 Rxf1#
bleda,1256,rosesntattoos,1785,-529,black,mate,142,e3 Nf6 f3 d5 Bb5+ c6 Bd3 b6 Ne2 Bb7 O-O g6 c3 Bg7 Bc2 O-O d3 Nbd7 Nf4 e5 Ne2 Re8 b3 c5 Ba3 Rc8 c4 dxc4 bxc4 e4 dxe4 Nxe4 Bxe4 Bxe4 Nbc3 Bc6 Bc1 Ne5 Qc2 Nxc4 Rd1 Qe7 Rd3 Rcd8 e4 Rxd3 Qxd3 b5 a3 Rd8 Qc2 Qd7 Bg5 f6 Bf4 Qd3 Qxd3 Rxd3 Bb8 a5 Bc7 f5 exf5 Bxc3 Rf1 gxf5 Nc1 Rd7 Bf4 Bd2 Bxd2 Rxd2 Nb3 Rd5 h3 Ne3 Re1 Rd1 Kf2 Rxe1 Kxe1 Nc2+ Kf2 Nxa3 Nxa5 Bd5 Ke3 Nc2+ Kd3 Ne1+ Kc3 Nxg2 Nb3 Bxb3 Kxb3 Ne1 h4 Nxf3 h5 Kg7 Kc3 Kh6 Kd3 Kxh5 Ke3 Nh2 Kf4 Kg6 Kg3 Nf1+ Kf3 b4 Ke2 Ng3+ Kf3 Ne4 Ke3 h5 Kd3 h4 Kc4 h3 Kd5 h2 Ke5 h1=Q Kd5 f4 Ke5 Kg5 Kd5 b3 Kc4 b2 Kb5 f3 Kc4 f2 Kd3 Kf5 Kc2 b1=Q#
check-masta,1232,anakgreget,1761,-529,black,resign,40,d4 d5 Nc3 Nf6 Bf4 a6 Qd3 Nc6 Nf3 Nb4 Qd2 Bf5 O-O-O Bxc2 Re1 Bf5 g3 e6 Bg2 Ne4 Nxe4 Bxe4 Qxb4 Bxb4 Rd1 Bxf3 Bxf3 O-O h4 Qf6 e3 Rac8 h5 c5 h6 g6 Be5 Qxf3 Rh4 cxd4+
check-masta,1232,anakgreget,1761,-529,black,resign,40,d4 d5 Nc3 Nf6 Bf4 a6 Qd3 Nc6 Nf3 Nb4 Qd2 Bf5 O-O-O Bxc2 Re1 Bf5 g3 e6 Bg2 Ne4 Nxe4 Bxe4 Qxb4 Bxb4 Rd1 Bxf3 Bxf3 O-O h4 Qf6 e3 Rac8 h5 c5 h6 g6 Be5 Qxf3 Rh4 cxd4+
torerikmeek,1176,sollids,1704,-528,black,resign,99,e4 e5 d4 exd4 Qxd4 Nc6 Qd3 Nf6 Bg5 Be7 Nd2 h6 Bxf6 Bxf6 O-O-O Nb4 Qa3 Nc6 Re1 Qe7 Qxe7+ Bxe7 Bb5 Nd4 Bf1 O-O c3 Ne6 h4 f5 exf5 Rxf5 Bd3 Rxf2 Rh2 Nf4 Kc2 Nxd3 Kxd3 Bd6 Nh3 Rxd2+ Kxd2 Bxh2 Re8+ Kf7 Re3 d6 Ke1 Bxh3 Rxh3 Re8+ Kf2 Be5 Re3 c5 b4 c4 Ke2 Bf4 Rxe8 Kxe8 Kd1 Bg3 h5 d5 Kd2 Be5 g4 b5 a3 a6 Kc2 Ke7 Kd2 d4 cxd4 Bxd4 Kc2 Ke6 Kd2 Ke5 Kc2 Ke4 Kd2 c3+ Kc2 Kd5 Kc1 Kc4 Kc2 Be5 Kc1 Bf4+ Kc2 Be3 Kd1 Kd3 Ke1
samuelpro,1149,spetchess,1677,-528,black,resign,34,d3 d5 e4 d4 c4 e5 f3 Bb4+ Nd2 Nf6 a3 Bd6 b3 O-O a4 Bb4 g4 a5 h3 c5 Ne2 h6 Bb2 Nh7 Bg2 Ng5 Rh2 Ne6 Ra2 Qh4+ Kf1 Nc6 Qe1 Qf6
stitch_13,1264,housssam,1792,-528,white,mate,103,d3 d5 e3 e5 Nd2 f5 Rb1 c5 b3 Nf6 Ba3 Be7 Bb2 Nc6 Ndf3 Qc7 Qd2 O-O Qe2 d4 e4 fxe4 Ng5 exd3 Qxd3 g6 Qc4+ Kg7 Ne6+ Bxe6 Qxe6 Rae8 Qc4 e4 Ne2 Qa5+ c3 dxc3 Bxc3 Qxa2 Ra1 Qc2 Rc1 Qd3 Bxf6+ Bxf6 Qxc5 Qxb3 Nc3 Qb4 Qe3 Qb2 Bb5 Rd8 O-O Rd3 Qxa7 Rxc3 Qxb7+ Kh6 Rxc3 Qxc3 Bxc6 Bh4 g3 Bg5 Bxe4 Qd2 f3 Be3+ Kh1 Qe2 Qb1 Rf6 Re1 Qf2 Rxe3 Qxe3 Qb5 Rb6 Qe8 Qe1+ Kg2 Rb2+ Kh3 Qf1+ Kh4 Rxh2+ Kg4 Qh3+ Kf4 g5+ Ke3 Qxg3 Qe6+ Kh5 Qf7+ Kh6 Qf6+ Kh5 Qf7+ Kh6 Qxh7#
dhernandez101,1440,parrotz,1968,-528,white,mate,57,e4 c5 Nc3 Nc6 Nf3 d6 d4 cxd4 Nxd4 Nxd4 Qxd4 Nf6 Nd5 e5 Qc4 Nxd5 Qxd5 Be7 Bb5+ Bd7 Bc4 O-O Qxb7 Rb8 Qxa7 Qc8 Ba6 Qxc2 Qxd7 Qxe4+ Be3 Bh4 O-O Rxb2 f3 Qxe3+ Kh1 Qh6 Rfd1 Bg3 h3 Rb6 Bc4 Qf4 Qc7 Bf2 a4 Qg3 a5 Rb2 Rdb1 Bb6 Qxf7+ Rxf7 Rxb2 Bd4 Rb8#
efeozbakir1,1188,ahmedmachine,1716,-528,black,mate,22,e4 e5 Nf3 Nc6 Nc3 Nf6 Be2 d5 O-O dxe4 Re1 exf3 gxf3 Bd6 b3 Nh5 f4 Nxf4 Nb5 Qg5+ Kh1 Qg2#
nitsua49,1678,salim1,2205,-527,black,resign,73,e4 e5 Nf3 Nc6 Bb5 a6 Ba4 d6 O-O Bg4 h3 Bd7 d4 exd4 Nxd4 Nxd4 Bxd7+ Qxd7 Qxd4 O-O-O Nc3 Be7 Qa7 Qc6 Nd5 Bf6 Nb4 Qb5 Nd5 Ne7 a4 Qc6 Nxe7+ Bxe7 Qd4 Bf6 Qd5 Qd7 c4 c6 Qf5 Qxf5 exf5 d5 c5 Rhe8 Bd2 Bxb2 Rae1 Ba3 Ba5 Rxe1 Rxe1 Rf8 Bb6 Kd7 g4 Bb4 Re2 g6 f4 gxf5 gxf5 Re8 Rxe8 Kxe8 Kf2 Ke7 Ke3 Kf6 a5 Kxf5 Bc7
john465,1285,dimitris22,1812,-527,black,mate,70,d4 Nf6 Nf3 g6 Bf4 Bg7 e3 d6 Bd3 O-O O-O Nfd7 Be2 Nc6 Nc3 e5 Bg3 f5 h3 e4 Nd2 g5 Bc4+ Kh8 Qh5 Nf6 Qxg5 d5 Bb5 Ne7 Be5 h6 Qh4 Ng6 Qg3 Nxe5 Qxe5 c6 Be2 Nd7 Qg3 Rg8 Qf4 Nf6 f3 Nh5 Qh2 Bf6 fxe4 Ng3 Rf2 fxe4 Bg4 h5 Be2 Bh4 Rf4 Nxe2+ Nxe2 Bg5 Rf7 Bxe3+ Kh1 Qg5 Nf1 Be6 Rxb7 Bf2 Qd6 Qxg2#
urukovstom,1619,thatmanlyllama,2145,-526,black,resign,72,d4 Nf6 Bf4 d5 e3 c5 Bd3 Nc6 c3 Qb6 Qc2 c4 Be2 Bf5 Qc1 e6 Nd2 a5 h3 a4 a3 Na5 f3 Nb3 Nxb3 Qxb3 g4 Bg6 h4 h5 g5 Ng8 Bd1 Qb6 Be5 f6 gxf6 gxf6 Bg3 Bd6 f4 Nh6 Bc2 Bxc2 Qxc2 Nf5 Bf2 Qc6 O-O-O Rhg8 Rh2 Ra6 e4 Bxf4+ Kb1 dxe4 Rh3 e3 Be1 Rxg1 d5 Qb5 dxe6 Rxe6 Rf3 e2 Rd8+ Kxd8 Rxf4 Rgxe1+ Ka2 Qb3+
assasin_creep,1743,steustache,2269,-526,black,resign,48,d4 d5 c4 Nc6 e3 dxc4 Bxc4 e5 Qf3 Qf6 Nd2 exd4 Qxf6 Nxf6 Bb5 dxe3 fxe3 Bd7 Bxc6 Bxc6 Ngf3 Bd6 Kf2 O-O-O Nc4 Ne4+ Ke2 Bb5 b3 Nc3+ Kf2 Be7 Bb2 Ne4+ Ke2 f6 Rhd1 Rxd1 Rxd1 Rd8 Nd4 Ba6 Kf3 Ng5+ Ke2 Ne4 Kd3 Nf2+
destroyer4,1277,meroxa,1803,-526,black,resign,38,d4 e6 e3 a6 Bd3 Nf6 f4 Nd5 Nf3 Nc6 O-O Be7 c4 Nf6 Nbd2 O-O Ne5 d6 Rf3 dxe5 Rh3 exf4 Bxh7+ Nxh7 Rxh7 Kxh7 Qh5+ Kg8 Ne4 fxe3 Ng5 Bxg5 Qxg5 Qxg5 Bxe3 Qxe3+ Kf1 Qxd4
a_p_t_e_m_u_u,1295,alexanderar1977,1821,-526,white,mate,25,e4 e5 Nf3 Nc6 d3 Bb4+ c3 Bc5 Ng5 Nf6 Be2 O-O d4 exd4 cxd4 Bxd4 Qc2 d6 O-O Bg4 Bxg4 Nxg4 e5 dxe5 Qxh7#
a_p_t_e_m_u_u,1295,alexanderar1977,1821,-526,white,mate,25,e4 e5 Nf3 Nc6 d3 Bb4+ c3 Bc5 Ng5 Nf6 Be2 O-O d4 exd4 cxd4 Bxd4 Qc2 d6 O-O Bg4 Bxg4 Nxg4 e5 dxe5 Qxh7#
oldpaths,1579,iris_foxspring,2105,-526,black,resign,47,d4 d5 Bf4 Nf6 Nf3 e6 e3 Bd6 Bg3 O-O Bd3 b6 Nbd2 Bb7 a3 Nbd7 c4 Bxg3 hxg3 Re8 Qb1 h6 e4 dxe4 Nxe4 e5 d5 c6 Nd6 e4 Nxe8 Qxe8 Bxe4 cxd5 cxd5 Ba6 Nd2 Nc5 f3 Qe5 Kd1 Qd4 Rh4 Qf2 Kc2 Rc8 Bd3
a_p_t_e_m_u_u,1295,alexanderar1977,1821,-526,white,mate,25,e4 e5 Nf3 Nc6 d3 Bb4+ c3 Bc5 Ng5 Nf6 Be2 O-O d4 exd4 cxd4 Bxd4 Qc2 d6 O-O Bg4 Bxg4 Nxg4 e5 dxe5 Qxh7#
tkhands,1500,sleepez,2026,-526,black,resign,42,d4 e6 c4 d5 Nf3 c6 e3 Bb4+ Nc3 Nf6 Bd2 O-O Bd3 h6 O-O Nbd7 a3 Bxc3 Bxc3 Nb6 c5 Nbd7 b4 b5 cxb6 axb6 Qb3 c5 Rfc1 c4 Bxc4 dxc4 Qxc4 Ba6 b5 Rc8 Qb4 Bb7 Nd2 Nd5 Bb2 Nxb4
mymanmitch65,1154,donzauker,1679,-525,black,resign,114,e4 e6 e5 d5 d4 c5 f4 cxd4 c3 Nc6 Na3 dxc3 bxc3 Qa5 Qd2 Bxa3 Bxa3 Qxa3 Be2 Nge7 Nf3 Bd7 Ng5 h6 Nf3 Nf5 O-O Qc5+ Rf2 d4 Rb1 dxc3 Rb5 cxd2 Rxc5 O-O Nxd2 Nfd4 Bh5 b6 Rc3 Rac8 Ne4 Nf5 Rff3 Nfd4 Rg3 Na5 Nf6+ Kh8 Rcd3 gxf6 Rxd4 Rc1+ Kf2 Rc2+ Kf1 Bb5+ Ke1 f5 Kd1 Rxa2 h3 Ra1+ Kc2 Rf1 Bd1 Rc8+ Kb2 Nc4+ Kb3 Na5+ Kb4 Ba6 Bh5 Nc6+ Kc3 Nxd4+ Kxd4 Rxf4+ Ke3 Re4+ Kf2 Rc2+ Kf3 Rc3+ Kf2 Rxg3 Kxg3 Rxe5 Bxf7 Kg7 Be8 Bb5 Bh5 f4+ Kxf4 Rxh5 g4 Rg5 h4 e5+ Kg3 Rxg4+ Kxg4 Kg6 h5+ Kf6 Kh4 Kf5 Kh3 Kg5 Kg3 Kxh5
frace,1145,dastan-2009,1669,-524,black,mate,56,d4 Nf6 f3 d5 Nc3 c5 e4 a6 dxc5 e6 Nge2 Bxc5 exd5 exd5 Na4 Ba7 g4 Nxg4 fxg4 Qh4+ Ng3 Bxg4 Qxd5 O-O Qxb7 Nd7 Qxa6 Nc5 Qb5 Nxa4 Qxa4 Bb8 Bf4 Rxa4 Bxb8 Rxb8 b3 Qf6 Rb1 Re8+ Be2 Bxe2 Nxe2 Rae4 Kd2 Rxe2+ Kd3 Qf3+ Kc4 Rc8+ Kb4 Re4+ Ka3 Qc3 Rb2 Qb4#
misfox,1107,jpadron19,1631,-524,black,resign,16,e4 e5 Qh5 Qe7 d3 Nf6 Qh3 Nc6 Bg5 d6 Qf3 Nd4 Qe3 Nxc2+ Ke2 Nxe3
xamio,967,valen0k,1491,-524,white,mate,49,e4 e5 Nf3 Nc6 Nc3 Bc5 d4 Bxd4 Nxe5 Bxe5 Bc4 Qf6 Qd5 Bd4 Be3 Bxe3 fxe3 Nh6 e5 Qf5 e4 Qf4 Rf1 Qxh2 Rxf7 Nxf7 Qxf7+ Kd8 Qxg7 Qg1+ Kd2 Qd4+ Kc1 Re8 Qf7 Qg1+ Kd2 Qxa1 Qf2 b6 Qf6+ Ne7 Nd5 Bb7 Bb5 c6 Qd6 cxb5 Qc7#
trx,1149,motion,1672,-523,black,resign,2,e4 d5
swingnoodle,1278,icecreamdealer,1801,-523,white,resign,17,e4 e5 Nf3 Nc6 Bc4 h6 d4 exd4 Nxd4 Nxd4 Qxd4 b6 O-O c5 Qd5 Qe7 Qxa8
trx,1149,motion,1672,-523,black,resign,62,d4 d5 c4 c6 e3 Bf5 Nc3 e6 Bd3 Bxd3 Qxd3 Nf6 Bd2 Bb4 Nf3 Bxc3 Bxc3 O-O O-O-O Ne4 Ne5 Nxf2 Qf1 Nxh1 Qxh1 Nd7 Nxd7 Qxd7 g3 dxc4 e4 b5 d5 cxd5 exd5 Qe7 d6 Qg5+ Bd2 Qc5 Bc3 Rad8 d7 b4 Bd4 Qc7 Bxg7 Kxg7 Qe1 Rxd7 Rxd7 Qxd7 Qe5+ Kg8 Qg5+ Kh8 Qe5+ Kg8 Qg5+ Kh8 Qe5+ f6
trx,1149,motion,1672,-523,black,resign,28,b4 a5 b5 c6 a4 d5 Bb2 Bf5 Nc3 Nf6 d4 e6 g3 Bb4 Bg2 Ne4 Bxe4 Bxe4 f3 Bg6 Qd2 O-O f4 Be4 O-O-O Bxh1 bxc6 Nxc6
trx,1149,motion,1672,-523,black,resign,17,d4 d5 e4 dxe4 Nc3 Bf5 g4 Bg6 f3 e6 fxe4 Qh4+ Kd2 Bb4 Nf3 Qf2+ Qe2
trx,1149,motion,1672,-523,black,mate,46,d4 d5 e4 dxe4 Nc3 Bf5 f3 e6 fxe4 Bg6 Bd3 Nc6 Be3 a6 Nf3 Bb4 Qd2 Ba5 O-O-O Nge7 Rhf1 Qd7 d5 exd5 exd5 Nxd5 Bxg6 hxg6 Bd4 O-O-O Ne5 Nxe5 Bxe5 f6 Qxd5 fxe5 Qxa5 Qg4 Rxd8+ Rxd8 Nb5 Qd7 Na7+ Kb8 Rd1 Qxd1#
shivangithegenius,978,jojo58,1500,-522,black,resign,22,d4 Nf6 Nc3 d6 d5 g6 e4 Bg7 Nf3 O-O Ng5 a6 Qf3 c6 Qg3 b5 Qh4 h6 Nf3 g5 Qxg5 hxg5
bugzzila,1458,chess-brahs,1980,-522,black,resign,41,g3 c6 Bg2 d5 d4 Nf6 Nc3 e6 Bg5 Be7 Bxf6 Bxf6 e4 dxe4 Nxe4 Bxd4 Ne2 Bxb2 Rb1 Qd5 Qxd5 cxd5 Nd6+ Kd7 Nxc8 Re8 Rxb2 Rxc8 O-O Nc6 Rxb7+ Rc7 Rxc7+ Kxc7 Rd1 Rb8 Nd4 Ne5 f4 Nc4 Nb5+
coco31,1154,fischerdipper,1676,-522,black,resign,40,d3 c5 Be3 d6 d4 cxd4 Qxd4 Nc6 Qd5 e6 Qb5 Bd7 a4 d5 Ra3 Bxa3 Nxa3 Nf6 b3 O-O c4 Ne5 cxd5 Bxb5 Nxb5 exd5 Bf4 Qa5+ Kd1 a6 e3 Neg4 h3 Nxf2+ Ke2 N6e4 Rh2 Qd2+ Kf3 axb5
amazingdiamonds1,1392,chessfantom,1914,-522,black,resign,3,e4 c5 Na3
drakon1,877,chiggen,1399,-522,black,resign,2,e3 d6
shivangithegenius,978,lucasimeon,1500,-522,white,mate,53,d4 f5 e3 Nf6 Nc3 d5 Bb5+ c6 Bd3 b5 Qf3 Qa5 Bxf5 Nbd7 Bxd7+ Bxd7 a3 Bg4 Qf4 h5 b4 Qb6 h3 Be6 Nf3 c5 bxc5 Qa5 Bb2 Rb8 Qxb8+ Kd7 Qb7+ Kd8 Qa8+ Bc8 c6 Qc7 Nxb5 Qxc6 Qxc6 Ne4 Qc7+ Ke8 Qxc8+ Kf7 Ne5+ Kf6 Nc7 e6 Qxe6+ Kg5 h4#
bugzzila,1458,chess-brahs,1980,-522,black,resign,41,g3 c6 Bg2 d5 d4 Nf6 Nc3 e6 Bg5 Be7 Bxf6 Bxf6 e4 dxe4 Nxe4 Bxd4 Ne2 Bxb2 Rb1 Qd5 Qxd5 cxd5 Nd6+ Kd7 Nxc8 Re8 Rxb2 Rxc8 O-O Nc6 Rxb7+ Rc7 Rxc7+ Kxc7 Rd1 Rb8 Nd4 Ne5 f4 Nc4 Nb5+
bugzzila,1458,chess-brahs,1980,-522,black,resign,41,g3 c6 Bg2 d5 d4 Nf6 Nc3 e6 Bg5 Be7 Bxf6 Bxf6 e4 dxe4 Nxe4 Bxd4 Ne2 Bxb2 Rb1 Qd5 Qxd5 cxd5 Nd6+ Kd7 Nxc8 Re8 Rxb2 Rxc8 O-O Nc6 Rxb7+ Rc7 Rxc7+ Kxc7 Rd1 Rb8 Nd4 Ne5 f4 Nc4 Nb5+
shivangithegenius,978,balkarec,1500,-522,black,resign,5,d4 e6 e4 Qh4 Nc3
shivangithegenius,978,jjwrchess,1500,-522,black,resign,3,e4 d5 exd5
thebestofthebad,850,projetoxadrez,1371,-521,black,resign,2,d4 g5
taranga,1289,armourbuddy,1810,-521,black,resign,60,e4 c5 Nf3 g6 d4 cxd4 Nxd4 Bg7 Nc3 a6 Bc4 e6 Bf4 Nc6 Nxc6 bxc6 Kf1 Ne7 Ke2 d5 exd5 cxd5 Bb3 O-O Re1 a5 Nb5 Ba6 c4 dxc4 Bxc4 Qxd1+ Raxd1 Nf5 Kf1 Nd4 Nxd4 Bxc4+ Kg1 Bxa2 Nb5 Bd5 Nc7 Rad8 Nxd5 Rxd5 Bd6 Rxd1 Rxd1 Rd8 Kf1 Bf8 Ke1 Bxd6 Ra1 Rb8 Rxa5 Bb4+ Kd1 Bxa5
taranga,1289,armourbuddy,1810,-521,black,resign,60,e4 c5 Nf3 g6 d4 cxd4 Nxd4 Bg7 Nc3 a6 Bc4 e6 Bf4 Nc6 Nxc6 bxc6 Kf1 Ne7 Ke2 d5 exd5 cxd5 Bb3 O-O Re1 a5 Nb5 Ba6 c4 dxc4 Bxc4 Qxd1+ Raxd1 Nf5 Kf1 Nd4 Nxd4 Bxc4+ Kg1 Bxa2 Nb5 Bd5 Nc7 Rad8 Nxd5 Rxd5 Bd6 Rxd1 Rxd1 Rd8 Kf1 Bf8 Ke1 Bxd6 Ra1 Rb8 Rxa5 Bb4+ Kd1 Bxa5
