white_id,white_rating,black_id,black_rating,elo_diff,winner,victory_status,turns,moves
burks,1016,lance5500,2621,-1605,black,mate,48,Nf3 Nf6 d4 g6 Bg5 Bg7 Nc3 d5 Qd3 Bf5 Qb5+ Nc6 Qa4 O-O O-O-O a6 Qb3 b5 Nxb5 axb5 a4 Ne4 Qxb5 Qd6 Rd3 Nxf2 Rg1 Nxd3+ cxd3 Rfb8 Qxb8+ Rxb8 Nh4 Nxd4 Nxf5 gxf5 Be3 Qc5+ Kd2 Nb3+ Ke1 Qxe3 d4 Rb6 h4 Rc6 g3 Rc1#
burks,1016,lance5500,2621,-1605,black,mate,40,Nc3 c5 Nf3 Nc6 Nb5 Nf6 c4 g6 Ng5 Bg7 d3 O-O Bf4 e5 e3 exf4 exf4 Re8+ Be2 d5 cxd5 Nxd5 Qb3 Nxf4 Qxf7+ Kh8 h4 Nxe2 Rf1 Nc3+ Qxe8+ Qxe8+ Kd2 Qe2+ Kc1 Nxb5 Rh1 Bxb2+ Kb1 Na3#
dinobzik,1214,lance5500,2621,-1407,black,resign,58,e4 c5 Nf3 d6 d4 Nf6 Nc3 cxd4 Nxd4 Nc6 Nxc6 bxc6 g3 Bg4 Qd3 g6 Bg2 Bg7 e5 Nd7 exd6 O-O dxe7 Qxe7+ Be3 Ne5 Qd4 Nf3+ Bxf3 Bxd4 Bxg4 Bxe3 fxe3 Qxe3+ Ne2 Rad8 Rd1 Rxd1+ Kxd1 Rd8+ Ke1 Rd2 Kf1 Rxc2 h4 Rxb2 Rh2 Rxa2 Rf2 h5 Bf3 Rc2 Kg2 a5 g4 hxg4 Bxg4 a4
crazyscientist1,1015,unicornz,2305,-1290,black,resign,22,e4 g6 d4 Bg7 Nc3 d6 f4 Nf6 Nf3 O-O Bd3 c5 e5 dxe5 dxe5 Nd5 Ne4 Nc6 Nxc5 Qa5+ Bd2 Qxc5
raulelbueno,1384,lance5500,2621,-1237,black,resign,22,f3 e5 g3 d5 Bg2 Nf6 b3 Be7 Na3 O-O Bb2 Nc6 Bc3 Bxa3 Ba5 Nxa5 Bh3 Bc5 a4 Bxg1 Rxg1 Bxh3
aleksander10032007,1433,lance5500,2621,-1188,black,resign,68,e4 c5 Nf3 d6 d4 Nf6 e5 dxe5 dxe5 Qxd1+ Kxd1 Ng4 Ke1 Nc6 Bf4 g5 Bg3 Bg7 Be2 Ngxe5 Bxe5 Nxe5 Nxg5 Ng6 Bb5+ Kf8 Nc3 Bxc3+ bxc3 Kg7 Bc4 e6 Rb1 b6 f3 Bb7 Bd3 Rhd8 Kf2 Rd7 Rhd1 Rad8 Ke2 h6 Nh3 Ne5 Be4 Bxe4 fxe4 Rxd1 Rxd1 Rxd1 Kxd1 Ng4 Nf4 Nxh2 Nh5+ Kg6 Nf4+ Kg5 Nh3+ Kg4 Nf2+ Kg3 Nh1+ Kxg2 Ng3 Kxg3
samuelpro,1157,critico-82,2312,-1155,black,resign,8,e4 c5 Bc4 e6 Qf3 Nc6 e5 Nxe5
mamaduck,1334,sparklehorse,2475,-1141,black,resign,54,d4 e6 c4 b6 Nc3 Bb7 a3 g6 e4 Bg7 Nf3 d6 Be2 Nd7 O-O Ne7 d5 Bxc3 bxc3 e5 Bh6 f6 Bg7 Rg8 Bxf6 Nxf6 Ng5 Bc8 Bg4 Bxg4 Qa4+ Bd7 Qd1 h6 Ne6 Bxe6 dxe6 Qc8 f4 Qxe6 Qa4+ Nd7 Rf3 a5 f5 gxf5 Raf1 f4 Kh1 O-O-O Rb1 Nc5 Qb5 Qd7
anonymous_enemy,1500,lance5500,2621,-1121,black,resign,86,b3 Nf6 Bb2 g6 e3 Bg7 Nf3 O-O c4 c5 d4 d5 Bd3 Nc6 O-O Bg4 dxc5 dxc4 Bxc4 Qa5 h3 Rfd8 Qe2 Bxf3 Qxf3 Qxc5 Rd1 Rxd1+ Qxd1 Rd8 Qe2 Ne4 Bxg7 Kxg7 Qb2+ e5 Nc3 Nxc3 Qxc3 b5 Rc1 bxc4 bxc4 h5 Rb1 Rd7 Rb5 Rd1+ Kh2 Qd6 f4 Rd3 fxe5 Qd8 Qb2 Rd2 Qc3 Qd3 Qa1 Qe2 e6+ f6 Rg5 Qxe3 Rg3 Qxe6 Qb1 Ne5 Qb7+ Qd7 Qe4 Rd1 Qe2 Qd4 Re3 Rd2 Qe1 Rxa2 Rb3 Rb2 Rxb2 Qxb2 Qd1 Qb8 Kh1 Qc7
grsa,1254,grandmasterreturn,2344,-1090,black,resign,13,d4 Nf6 c4 e6 Nf3 d5 Nc3 c6 Bf4 Qa5 e3 Bb4 cxd5
louwyhs,1085,lordofking,2171,-1086,black,mate,38,e4 c5 Nf3 e6 Nc3 Nc6 d3 a6 Be3 b5 a3 Bb7 Be2 Nf6 h3 d5 e5 Nd7 O-O Ncxe5 Nxe5 Nxe5 Bf3 Nxf3+ Qxf3 Bd6 Qh5 O-O f4 d4 Ne4 dxe3 Nxd6 Qxd6 Qe5 Qc6 f5 Qxg2#
hus1972,1074,dunker62,2151,-1077,black,mate,28,e3 e5 Be2 d5 Nf3 e4 Ne5 Qg5 Rg1 Qxe5 Na3 Qxh2 Rf1 Bxa3 bxa3 Qxg2 a4 Nc6 c3 Bh3 Qc2 Qh2 Kd1 Bxf1 Bb2 Qxf2 Bxf1 Qxf1#
hash_13-chess,1128,powodzenia,2177,-1049,black,mate,130,g3 g6 Bg2 Bg7 Nf3 Nf6 Nc3 O-O O-O d5 d4 Bf5 h3 Na6 g4 Bc8 g5 Nh5 e4 dxe4 Nxe4 c6 c4 Bf5 Ng3 Nxg3 fxg3 Be4 Re1 Bxf3 Bxf3 Qxd4+ Qxd4 Bxd4+ Kf1 e6 Be3 Bxe3 Rxe3 Rfd8 h4 Rd2 b3 Nb4 Re2 Rxe2 Bxe2 Rd8 Rd1 Rxd1+ Bxd1 Nxa2 h5 Nc3 Ke1 Nxd1 Kxd1 Kf8 hxg6 hxg6 Ke2 Ke7 Kf3 Kd6 Ke4 c5 Kf4 a6 Ke4 b5 cxb5 axb5 Kd3 Ke5 Kc3 Kf5 Kd3 Kxg5 Ke4 f5+ Ke5 Kg4 Kxe6 c4 bxc4 bxc4 Kf6 c3 Kxg6 c2 Kf6 c1=Q Kg6 Qg1 Kf6 Qxg3 Kg6 Qe3 Kf6 f4 Kg6 Qe5 Kf7 Qd6 Kg7 Qe6 Kh7 Kg5 Kg7 Qf6+ Kh7 Qg6+ Kh8 Qf6+ Kh7 Qf7+ Kh8 Qa7 Kg8 Kg6 Kf8 Qd7 Kg8 f3 Kf8 f2 Kg8 f1=R Kh8 Rf8#
hash_13-chess,1128,powodzenia,2177,-1049,black,mate,130,g3 g6 Bg2 Bg7 Nf3 Nf6 Nc3 O-O O-O d5 d4 Bf5 h3 Na6 g4 Bc8 g5 Nh5 e4 dxe4 Nxe4 c6 c4 Bf5 Ng3 Nxg3 fxg3 Be4 Re1 Bxf3 Bxf3 Qxd4+ Qxd4 Bxd4+ Kf1 e6 Be3 Bxe3 Rxe3 Rfd8 h4 Rd2 b3 Nb4 Re2 Rxe2 Bxe2 Rd8 Rd1 Rxd1+ Bxd1 Nxa2 h5 Nc3 Ke1 Nxd1 Kxd1 Kf8 hxg6 hxg6 Ke2 Ke7 Kf3 Kd6 Ke4 c5 Kf4 a6 Ke4 b5 cxb5 axb5 Kd3 Ke5 Kc3 Kf5 Kd3 Kxg5 Ke4 f5+ Ke5 Kg4 Kxe6 c4 bxc4 bxc4 Kf6 c3 Kxg6 c2 Kf6 c1=Q Kg6 Qg1 Kf6 Qxg3 Kg6 Qe3 Kf6 f4 Kg6 Qe5 Kf7 Qd6 Kg7 Qe6 Kh7 Kg5 Kg7 Qf6+ Kh7 Qg6+ Kh8 Qf6+ Kh7 Qf7+ Kh8 Qa7 Kg8 Kg6 Kf8 Qd7 Kg8 f3 Kf8 f2 Kg8 f1=R Kh8 Rf8#
toni90,1081,rps_1899,2126,-1045,white,resign,3,e4 e5 Nf3
dimcenco,978,lichessfiend,2005,-1027,black,mate,54,e4 c5 Nc3 Nc6 d4 cxd4 Nce2 e5 Nf3 Bb4+ Bd2 Qa5 c3 dxc3 bxc3 Bc5 c4 Qb6 Rb1 Qc7 Bc3 d6 Rb5 a6 Ba5 Nxa5 Rb1 Nf6 Nc3 O-O Be2 Be6 O-O Bxc4 Na4 b5 Nxc5 dxc5 Rc1 Bxe2 Qxe2 Nc4 Rxc4 bxc4 Qxc4 Rfd8 Qc2 Qd6 Rd1 Qxd1+ Qxd1 Rxd1+ Ne1 Rxe1#
hurameshi,1305,yht,2318,-1013,black,mate,90,d4 d5 c4 c6 Nf3 Nf6 Bg5 h6 Bh4 dxc4 e3 Bf5 Bxc4 Qb6 Qe2 Nbd7 Nc3 g5 Bg3 O-O-O O-O e6 Rac1 Ne4 Na4 Qa5 b3 Nxg3 fxg3 Ba3 Rc3 Kb8 Ne5 Nxe5 dxe5 b5 Bxb5 cxb5 Rc6 bxa4 bxa4 Bd3 Rb1+ Bxb1 h3 Qd5 Rd6 Bxd6 Qb2+ Qb7 Qxb7+ Kxb7 exd6 Rxd6 g4 Rd2 Kh2 Rc8 Kg3 Rcc2 Kf3 Rxg2 Ke4 f5+ gxf5 exf5+ Kxf5 Rg3 e4 Rxh3 e5 Re2+ Kf6 Rhe3 a5 Rxe5 a6+ Kxa6 a4 Re6+ Kg7 Rg6+ Kf7 Rb2 Ke7 Rb7+ Kf8 Rc6 Ke8 Rc8#
bischopscup,1212,fakemagnuscarlsen,2215,-1003,black,mate,52,d4 Nf6 c4 e6 Nc3 Bb4 Bd2 c5 d5 O-O dxe6 dxe6 e4 Bxc3 Bxc3 Nxe4 Bd3 Nxc3 bxc3 Nc6 Ne2 Ne5 Bc2 b6 O-O Bb7 f4 Nxc4 Bb3 Ne3 Qxd8 Raxd8 Rf3 Bxf3 gxf3 Rd2 Ng3 c4 Ba4 Rfd8 Nf1 Nxf1 Rxf1 Rxa2 Bc6 Rdd2 f5 Rg2+ Kh1 Rxh2+ Kg1 Rag2#
suziernesti,1151,siindbad,2135,-984,black,mate,38,h4 d5 a4 e5 e4 dxe4 Qe2 Nc6 c4 Nf6 c5 Nd4 Qxe4 Nxe4 Nc3 Nxc3 bxc3 Nc2+ Ke2 Nxa1 c4 Qd4 Nf3 Qe4+ Kd1 Qc2+ Ke1 Qxc1+ Ke2 Bg4 g3 O-O-O Ke3 Qd1 Be2 Nc2+ Ke4 Qxe2#
schoonied,1319,chesswithmom,2296,-977,black,mate,44,e4 e5 c3 Qf6 Qg4 Bc5 f3 h5 Qg3 h4 Qf2 Bxf2+ Kd1 Qd6 Bc4 Be3 Bxf7+ Kxf7 b3 Nc6 Ke1 Bf4 a3 Qd3 Kd1 Qf1+ Kc2 Qxg2 a4 Qxh1 b4 Qxg1 Kb3 Qxc1 Kc4 Qf1+ Kb3 Qd1+ Kc4 d6 Ra3 Be6+ Kb5 a6#
schoonied,1319,chesswithmom,2296,-977,black,mate,42,e4 e5 d3 Bc5 c4 Qf6 Ne2 Qxf2+ Kd2 Bb4+ Kc2 a5 Kb3 Qc5 Bg5 Nc6 a4 Nd4+ Ka2 f6 Nbc3 b5 Qb3 bxa4 Nxd4 exd4 Qxa4 dxc3 Kb3 Bb7 Bf4 Bc6 Bxc7 Bxa4+ Ka2 Qxc7 g4 Qf4 Rd1 Qf2 Bh3 Qxb2#
schoonied,1319,chesswithmom,2296,-977,black,mate,42,e4 e5 d3 Bc5 c4 Qf6 Ne2 Qxf2+ Kd2 Bb4+ Kc2 a5 Kb3 Qc5 Bg5 Nc6 a4 Nd4+ Ka2 f6 Nbc3 b5 Qb3 bxa4 Nxd4 exd4 Qxa4 dxc3 Kb3 Bb7 Bf4 Bc6 Bxc7 Bxa4+ Ka2 Qxc7 g4 Qf4 Rd1 Qf2 Bh3 Qxb2#
schoonied,1319,chesswithmom,2296,-977,black,mate,44,e4 e5 c3 Qf6 Qg4 Bc5 f3 h5 Qg3 h4 Qf2 Bxf2+ Kd1 Qd6 Bc4 Be3 Bxf7+ Kxf7 b3 Nc6 Ke1 Bf4 a3 Qd3 Kd1 Qf1+ Kc2 Qxg2 a4 Qxh1 b4 Qxg1 Kb3 Qxc1 Kc4 Qf1+ Kb3 Qd1+ Kc4 d6 Ra3 Be6+ Kb5 a6#
schoonied,1319,chesswithmom,2294,-975,black,mate,48,d4 d5 e3 e6 Bb5+ c6 Bd3 Qa5+ c3 Nf6 Qb3 Ne4 Nf3 Qd8 O-O Qf6 Qd1 Bd6 a4 e5 dxe5 Bxe5 Nxe5 Qxe5 Qf3 Bf5 Bxe4 dxe4 Qxf5 Qxf5 f4 Nd7 c4 Nf6 Bd2 O-O-O Ba5 b6 Bc3 Rd3 Be1 Rxe3 Bf2 Re2 Bg3 Qc5+ Rf2 Re1#
schoonied,1319,chesswithmom,2294,-975,black,mate,32,d4 Nf6 e3 e6 Nc3 Bb4 Bd2 c5 Nb5 Bxd2+ Qxd2 cxd4 exd4 O-O O-O-O d5 Be2 a6 Nc3 Nc6 Nf3 Ne4 Qe3 Qa5 Rhe1 Nxc3 Rd2 Nxa2+ Kd1 Nc3+ Kc1 Qa1#
schoonied,1319,chesswithmom,2294,-975,black,mate,32,Nf3 Nf6 d4 d5 c3 Nc6 e3 Bg4 Bb5 a6 Bxc6+ bxc6 O-O Ne4 Nbd2 h5 Qe1 h4 b4 h3 g3 e6 Ne5 Qf6 Nxg4 Qf5 Qe2 Nxd2 Bxd2 Qe4 Rae1 Qg2#
schoonied,1319,chesswithmom,2294,-975,black,mate,32,Nf3 Nf6 d4 d5 c3 Nc6 e3 Bg4 Bb5 a6 Bxc6+ bxc6 O-O Ne4 Nbd2 h5 Qe1 h4 b4 h3 g3 e6 Ne5 Qf6 Nxg4 Qf5 Qe2 Nxd2 Bxd2 Qe4 Rae1 Qg2#
schoonied,1319,chesswithmom,2294,-975,black,mate,48,d4 d5 e3 e6 Bb5+ c6 Bd3 Qa5+ c3 Nf6 Qb3 Ne4 Nf3 Qd8 O-O Qf6 Qd1 Bd6 a4 e5 dxe5 Bxe5 Nxe5 Qxe5 Qf3 Bf5 Bxe4 dxe4 Qxf5 Qxf5 f4 Nd7 c4 Nf6 Bd2 O-O-O Ba5 b6 Bc3 Rd3 Be1 Rxe3 Bf2 Re2 Bg3 Qc5+ Rf2 Re1#
schoonied,1319,chesswithmom,2294,-975,black,mate,32,d4 Nf6 e3 e6 Nc3 Bb4 Bd2 c5 Nb5 Bxd2+ Qxd2 cxd4 exd4 O-O O-O-O d5 Be2 a6 Nc3 Nc6 Nf3 Ne4 Qe3 Qa5 Rhe1 Nxc3 Rd2 Nxa2+ Kd1 Nc3+ Kc1 Qa1#
rodrigo-sagastegui,1293,chesscarl,2263,-970,black,resign,30,e4 Nf6 h3 Nxe4 Qf3 Nf6 g4 e6 g5 Nd5 h4 Nc6 c3 Bd6 Qd1 O-O d3 b6 c4 Nde7 h5 Bb7 g6 Nd4 gxf7+ Rxf7 Rh4 Bf3 Nxf3 Nxf3+
mosi64,1301,aqwert,2266,-965,black,mate,80,e4 d5 Nc3 d4 Nd5 e6 Nf4 Qf6 d3 Bb4+ Bd2 Bxd2+ Qxd2 Nc6 c4 e5 Nd5 Qd6 Nf3 Nge7 Nh4 Nxd5 cxd5 Ne7 Nf5 Nxf5 exf5 O-O g4 Qxd5 Rg1 f6 h4 e4 Bg2 Qe5 h5 exd3+ Kd1 h6 Qxd3 Re8 Kd2 Qf4+ Kc2 Qxf2+ Qd2 Re2 Rad1 Rxd2+ Rxd2 Qxg1 Bd5+ Kh7 Rg2 Qe3 g5 hxg5 h6 gxh6 Bc4 Bxf5+ Kd1 Qf3+ Re2 Bg4 Kd2 d3 Bxd3+ f5 Re7+ Kg6 Rxc7 Qf4+ Kc3 Qxc7+ Kd4 Rd8+ Ke3 Qf4#
casparow,1305,doraemon61,2264,-959,black,resign,37,e4 e5 Nf3 Nc6 Bc4 Nf6 d3 Be7 Nc3 d6 Ng5 O-O O-O Bg4 f3 Bd7 Nd5 Nxd5 Bxd5 Bxg5 Bxg5 Qxg5 Qe1 a5 f4 exf4 h4 Qf6 g3 Nd4 Rxf4 Qxf4 gxf4 Nf3+ Kf1 Nxe1 Rd1
marigw,986,kang-heri,1944,-958,black,mate,42,d4 d5 c3 c6 b4 Nf6 a4 a5 bxa5 Qxa5 Na3 e6 Nb5 cxb5 Bg5 Qxc3+ Qd2 Qxa1+ Qd1 Qxd1+ Kxd1 bxa4 e3 a3 Bb5+ Bd7 Ba4 Rxa4 Ke2 a2 Nf3 Bb5+ Kd2 Bb4+ Kc2 Bc4 Kb2 Nc6 Ka1 Bd3 Nd2 Bc3#
mrunobservant,1000,kilgour22,1951,-951,black,mate,46,e4 e5 Nf3 Nc6 d4 exd4 Nxd4 d6 f4 Nf6 Bd3 Nxd4 e5 Nd7 Be3 dxe5 c3 Nc6 Qb3 exf4 Bxf4 Qe7+ Be2 Nf6 Nd2 Bg4 Nf3 Bxf3 gxf3 O-O-O a4 Re8 Qd1 Nd5 Bd2 Ne3 Qc1 Ng2+ Kf2 Qxe2+ Kg3 h5 Rg1 h4+ Kh3 Qxf3#
noobdude,1670,lance5500,2621,-951,black,resign,74,e4 c5 Nf3 d6 d4 Nf6 Nc3 cxd4 Nxd4 Nc6 Bb5 Bd7 Bg5 Rc8 O-O e6 Be2 Be7 a3 a6 Re1 O-O Qd2 Qc7 h3 Rfd8 Nf3 b5 Bd3 Ne5 Nxe5 dxe5 Qe2 Bc6 Be3 Nd7 Rf1 Bc5 Rac1 Qb6 b4 Bd4 Bxd4 Qxd4 Qe1 Bb7 Ne2 Qa7 Ng3 Nf8 Nh1 Ng6 g3 Qd4 Qe2 Qc3 Ra1 Ne7 Kg2 Nc6 Rfc1 Nd4 Qe1 Qxe1 Rxe1 Nxc2 Bxc2 Rxc2 h4 Rd4 Kg1 Bxe4 Rf1 Rdd2
noobdude,1670,lance5500,2621,-951,black,resign,86,e4 c5 Nf3 d6 d4 Nf6 Nc3 cxd4 Nxd4 Nc6 Bb5 Bd7 O-O e6 Bg5 Be7 Re1 Rc8 Bf1 a6 Nf3 O-O a3 Qc7 Qd3 Rfd8 h3 Ne5 Nxe5 dxe5 Qe2 Bc6 Be3 Nxe4 Nxe4 Bxe4 Bb6 Qxb6 Qxe4 Rd2 Re2 Rxe2 Qxe2 Qxb2 Re1 Rxc2 Qxe5 Qxe5 Rxe5 Bc5 Re2 Rxe2 Bxe2 Bxa3 Kf1 Kf8 Ke1 Ke7 Kd2 Kd6 Kc3 b5 Bd3 Kc5 Bxh7 e5 g4 f6 f3 a5 Be4 a4 h4 b4+ Kc2 b3+ Kc3 Bb4+ Kb2 Kc4 Bf5 a3+ Kc1 a2 Be6+ Kc3
pietaritamminen,1416,yellowdragoon,2361,-945,black,mate,42,e4 e5 f4 d5 Nc3 exf4 Nf3 dxe4 Nxe4 Bf5 Ke2 Bxe4 d3 Bxf3+ Kxf3 Qd5+ Kxf4 Bd6+ Ke3 Nf6 Qf3 Qxf3+ Kxf3 O-O Bg5 Nbd7 Bxf6 Nxf6 g3 Rfe8 Bg2 Re7 Rhe1 Rae8 Rxe7 Rxe7 Kf2 Ng4+ Kg1 Bc5+ Kf1 Nxh2#
ranchowangdu,1500,nobodyreally,2445,-945,white,resign,124,e4 c5 Nf3 d6 d4 cxd4 Nxd4 Nf6 f3 Nc6 c4 g6 Nc3 Nxd4 Qxd4 Bg7 Be3 O-O Qd2 Bd7 Be2 a6 Rc1 Qa5 O-O Rfe8 Rfd1 b5 c5 b4 Nd5 Nxd5 exd5 dxc5 Rxc5 Qxa2 Bd4 Bxd4+ Qxd4 Bf5 Bc4 b3 Qc3 Bc2 Re1 Qa4 Rc7 Rac8 d6 Rxc7 dxc7 e6 Bxb3 Bxb3 c8=Q Rxc8 Qxc8+ Kg7 Qc3+ Kg8 Re4 Qa1+ Kf2 Ba4 Rb4 Bb5 Rd4 Qf1+ Kg3 Be8 Rd8 Qb5 Qf6 Kf8 h4 h5 b4 Qc6 f4 Qa4 Kh2 Qb5 Rc8 Qd7 Ra8 Qc6 Qd8 Qb5 Rb8 Qc6 Rc8 Qb5 Rb8 Qc6 Rc8 Qb5 Kg3 Qa4 Rb8 Qc6 Kh2 Qa4 Qc8 Ke7 Qc5+ Kf6 Qe5+ Ke7 Rb7+ Bd7 Qc7 Qd1 Rb8 Qe1 Qd8+ Kd6 Rb6+ Kd5 Qxd7+ Ke4 Qc6+ Kd4 Qc5+ Ke4
element4life,1190,ezevereth,2133,-943,black,resign,40,e4 e5 Nf3 Nc6 Nc3 d6 Bc4 Be6 d3 Bxc4 dxc4 Nf6 Bg5 Be7 O-O O-O Re1 Nd7 Qd5 Bxg5 Nxg5 Qxg5 Rad1 Nb6 Qb5 Nd4 Rc1 c6 Qb4 c5 Qa3 Nxc4 Qa4 Nxb2 Qd7 Rfd8 Qf5 Nxf5 exf5 Qxf5
chicago_chess,1366,pavvell,2301,-935,black,resign,94,e4 c5 Nf3 e6 Nc3 a6 d4 cxd4 Nxd4 Qc7 g3 Bb4 Bd2 Nc6 Nde2 Nf6 Bg2 O-O Bf4 Qa5 O-O Be7 e5 Nxe5 Bxe5 Qxe5 Qd4 Qxd4 Nxd4 d5 Rfe1 Bb4 a3 Bxc3 bxc3 Bd7 c4 Rac8 cxd5 exd5 f4 Rfe8 Rxe8+ Rxe8 Rb1 b5 h4 Re3 Kf2 Ng4+ Kg1 Rxg3 Ne2 Rxa3 Bxd5 Ne3 Nd4 Nxd5 c4 Nc3 Rb2 g6 Nc2 Ra2 Rxa2 Nxa2 Nb4 Nxb4 cxb5 axb5 Kf1 Nd3 Ke2 Nxf4+ Ke3 Ng2+ Kd4 Nxh4 Kc5 f5 Kd4 f4 Ke4 f3 Ke3 b4 Kd3 b3 Kc3 f2 Kxb3 f1=Q Kc2 Qc4+
nullvalue,1299,youralterego,2221,-922,black,resign,44,e4 e5 Nf3 Nc6 Bb5 Nf6 d3 a6 Bxc6 dxc6 O-O Bd6 b3 O-O Bb2 Re8 Nbd2 Qe7 c4 c5 a4 a5 h4 Nh5 g3 Bg4 Qe2 Rad8 Bc3 b6 Qe3 h6 d4 exd4 Bxd4 cxd4 Qxd4 Bc5 Qc3 Nxg3 Rfd1 Ne2+ Kg2 Nxc3
mehmetali_t,1541,michelangeio,2460,-919,black,resign,49,e4 c6 d4 d5 exd5 cxd5 Nf3 Nc6 Nc3 Bg4 Be2 e6 Bf4 Nf6 a3 Bd6 Be3 O-O Qd2 Rc8 h3 Bh5 g4 Bg6 O-O-O Qa5 Rdg1 Bxa3 bxa3 Qxa3+ Kd1 Nb4 Nb1 Qb2 Qc1 Bxc2+ Ke1 Qxc1+ Bxc1 Bxb1 g5 Rxc1+ Kd2 Rxg1 Rxg1 Ne4+ Kc1 Bd3 Bxd3
thebestofthebad,835,carlos-freire,1754,-919,black,resign,2,d4 d5
aynaz22,1371,aqwert,2282,-911,black,mate,90,g3 e5 Bh3 b6 f4 Bb7 f5 Bxh1 e3 Nf6 g4 d5 g5 Ne4 d3 Nxg5 a4 Qf6 Na3 Nxh3 Nxh3 Qxf5 Nf4 exf4 exf4 Qh3 Qe2+ Be7 f5 Nc6 Bg5 f6 Bf4 Nd4 Qe3 Nxf5 Qxh3 g6 Bxc7 Bxa3 bxa3 O-O c3 Rfe8+ Kd1 Ne3+ Kd2 Bg2 Qxe3 Rxe3 Kxe3 Rc8 Bd6 Rxc3 Rg1 Be4 Rg4 Rxd3+ Ke2 Rb3 Be7 Bf3+ Kf1 Bxg4 Bxf6 Rxa3 Be7 Rxa4 Bd8 d4 Bf6 d3 Ke1 Re4+ Kf1 Rf4+ Kg2 Rxf6 h3 d2 hxg4 d1=Q g5 Qf1+ Kg3 Rf2 Kg4 Qg2+ Kh4 Rf4#
cerseisminge,1389,votseff,2297,-908,black,resign,37,c4 c5 Nc3 Nc6 e3 Nf6 Qc2 d5 d3 dxc4 dxc4 Nb4 Qa4+ Bd7 Qb3 Bf5 Qd1 Nc2+ Qxc2 Bxc2 Nge2 Ne4 f3 Nxc3 bxc3 Qd1+ Kf2 Bd3 Nf4 Qc2+ Kg3 Bxf1 Rxf1 Qxc3 Ne2 Qxa1 Bd2
koryakinrus,1715,lance5500,2621,-906,black,resign,104,e4 c5 Nf3 d6 d4 Nf6 e5 dxe5 Nxe5 Qxd4 Qxd4 cxd4 Bb5+ Nbd7 Bxd7+ Nxd7 Nf3 e5 b3 Bb4+ Nbd2 f6 O-O Nb6 a3 Be7 Ne4 Bf5 Re1 Rc8 Ra2 Kf7 b4 Rc7 Re2 Rhc8 Ne1 Nd5 Bd2 Be6 Ra1 h6 f3 f5 Ng3 Ne3 Bxe3 dxe3 h3 f4 Ne4 Bc4 Nd3 Bxd3 cxd3 Rc1+ Rxc1 Rxc1+ Kh2 g5 g3 h5 g4 hxg4 hxg4 Rd1 Ra2 Rxd3 Kg2 Ke6 Kf1 b6 Ke2 Rd8 Rc2 Kd7 Kd3 Ke6+ Ke2 a5 bxa5 bxa5 a4 Rd4 Ra2 Kd5 Rc2 Rxe4 fxe4+ Kxe4 Rc4+ Kd5 Rc7 Bc5 Rd7+ Ke4 Rd8 f3+ Ke1 Bb4+ Kd1 e2+ Kc2 e1=Q
koryakinrus,1715,lance5500,2621,-906,black,resign,17,e4 c5 Nf3 d6 d4 Nf6 e5 dxe5 dxe5 Qxd1+ Kxd1 Ng4 Bc4 Nxf2+ Ke2 Nxh1 Be3
aynaz22,1371,aqwert,2267,-896,black,mate,58,f3 e5 g4 d5 Bh3 e4 g5 Bxh3 Nxh3 exf3 exf3 Qe7+ Qe2 Nc6 b3 Nd4 Qe3 Nxc2+ Ke2 Nxe3 dxe3 Qe5 f4 Qxa1 Nd2 Qxa2 f5 O-O-O Rf1 d4 exd4 Rxd4 g6 hxg6 Ng5 Rxh2+ Rf2 Qa6+ Nc4 Rxf2+ Kxf2 gxf5 Nxf7 Qa2+ Bd2 Qxb3 Nfd6+ cxd6 Nxd6+ Bxd6 Be3 Bg3+ Kxg3 Qxe3+ Kg2 Rd2+ Kf1 Qf2#
hadzo,1236,brahim333,2131,-895,black,resign,77,e4 c6 d4 d5 e5 e6 Nf3 Ne7 g4 Ng6 h4 c5 a3 Qb6 c3 Nc6 Be3 Na5 b4 cxb4 axb4 Nc4 Qd3 Nxe3 fxe3 Be7 h5 Nf8 e4 Nd7 exd5 exd5 Bg2 f6 Rf1 O-O g5 fxg5 Nbd2 g4 Ng5 Bxg5 Rxf8+ Nxf8 Bxd5+ Ne6 Qf5 Bh4+ Kf1 Qb5+ c4 Qxb4 Ne4 Qf8 Bxe6+ Bxe6 Nf6+ gxf6 Qxe6+ Kh8 Qxg4 fxe5+ Ke2 Be7 Rf1 Qh6 Rg1 exd4 Qxd4+ Bf6 Qe4 Qxh5+ Kf1 Qh3+ Rg2 Rf8 Qf5
mimirilinguis,1026,surya9415,1916,-890,black,mate,90,d3 e5 e3 Nf6 f3 Nh5 g4 Qh4+ Kd2 Nf6 Qe1 Qxe1+ Kxe1 Be7 g5 Nd5 h4 g6 e4 Nb6 a4 d6 a5 N6d7 b4 O-O Be3 Re8 Nd2 c6 Kd1 d5 Ke2 Bxb4 exd5 cxd5 Nb3 d4 Bd2 Bxd2 Nxd2 Nc6 Re1 Nxa5 Bh3 Nf8 Bxc8 Raxc8 Kd1 Rc7 Ne2 Rec8 Nc4 Nxc4 dxc4 Rxc4 Kd2 Rxc2+ Kd3 Nd7 Rc1 Rxc1 Rxc1 Rxc1 Nxc1 Nc5+ Kc4 b6 Nb3 Nxb3 Kxb3 a5 Ka4 Kf8 Kb5 d3 Kxb6 a4 Ka5 a3 Kb4 a2 Kb3 a1=Q Kc4 Qd4+ Kb3 d2 Kc2 d1=Q#
evan_h1234,1331,chesscoach,2209,-878,black,mate,60,d4 g6 Nf3 Bg7 c4 c5 dxc5 Qa5+ Nfd2 Qxc5 e3 Nf6 f3 Qxe3+ Qe2 Qc5 Ne4 Qd4 Nxf6+ Qxf6 Nc3 O-O Nd5 Qh4+ g3 Qd4 Nxe7+ Kh8 Nxc8 Rxc8 Qe7 Nc6 Qxf7 Ne5 Qf4 Qxf4 gxf4 Nxf3+ Kf2 Nd4 Be3 Nc2 Rc1 Nxe3 Kxe3 Bxb2 Rb1 Re8+ Kf2 Bd4+ Kf3 b6 Kg4 Re3 Kg5 Rf8 Rc1 Rf5+ Kh6 Bg7#
sveenemand,1091,krluch,1958,-867,black,mate,62,e3 e5 d3 d5 Be2 f5 Bd2 Nf6 Nf3 Nc6 Nc3 e4 O-O exf3 Bxf3 a6 Rb1 Be7 h3 O-O a3 h6 Bh5 Nxh5 g4 Nf6 gxf5 Bxf5 Kg2 Bd6 Qg4 Bxg4 f3 Bh5 Ne4 dxe4 dxe4 Qe8 Ba5 Qg6+ Kf2 Nxe4+ Ke2 Ng3+ Kf2 Rxf3+ Ke1 Rxf1+ Kd2 Ne4+ Kd3 Nc5+ Kd2 Qg2+ Kc3 Be5+ Kc4 Qxc2+ Kd5 Bf3+ e4 Bxe4#
sveenemand,1091,krluch,1958,-867,black,mate,62,e3 e5 d3 d5 Be2 f5 Bd2 Nf6 Nf3 Nc6 Nc3 e4 O-O exf3 Bxf3 a6 Rb1 Be7 h3 O-O a3 h6 Bh5 Nxh5 g4 Nf6 gxf5 Bxf5 Kg2 Bd6 Qg4 Bxg4 f3 Bh5 Ne4 dxe4 dxe4 Qe8 Ba5 Qg6+ Kf2 Nxe4+ Ke2 Ng3+ Kf2 Rxf3+ Ke1 Rxf1+ Kd2 Ne4+ Kd3 Nc5+ Kd2 Qg2+ Kc3 Be5+ Kc4 Qxc2+ Kd5 Bf3+ e4 Bxe4#
samuelpro,1073,pimag-45,1939,-866,black,mate,16,d3 e5 e4 Bc5 c4 Nf6 f3 O-O g4 Nc6 h3 Nd4 b3 Nxe4 a4 Qh4#
chesswith666,1149,nytik,2013,-864,black,resign,60,d4 d5 c4 c6 Nc3 Nf6 g3 dxc4 Bg2 g6 e4 Bg7 Nf3 O-O O-O Nbd7 Bg5 h6 Bxf6 Nxf6 a4 Qb6 Qd2 a5 d5 cxd5 exd5 Rd8 Rad1 Bf5 Nh4 Bd3 Rfe1 Qc5 b3 Rac8 Qe3 Qxe3 Rxe3 Bc2 Rd2 cxb3 Rxe7 Rxc3 Rxb7 Ne4 Re2 Nc5 Ra7 Nxa4 Ree7 b2 Rxf7 b1=Q+ Bf1 Bd4 Rg7+ Bxg7 Nxg6 Bxg6
jamila1234,1348,futuro_gm22,2208,-860,black,mate,62,d4 Nf6 c3 d6 e3 g6 Qf3 Bg7 Nd2 O-O Nh3 Nc6 Ng5 h5 Bc4 d5 Bb5 h4 Bxc6 bxc6 Qf4 h3 g3 Ng4 Qf3 e5 Nxh3 Nxe3 fxe3 Bxh3 Nb3 f5 Bd2 Bg4 Qg2 e4 Nc5 Bf3 Qf1 Bxh1 Qxh1 Qd6 Nb7 Qd7 Nc5 Qe7 O-O-O a5 a4 Rab8 b3 Rxb3 Nxb3 Qa3+ Kc2 Qa2+ Kc1 Qxb3 h3 Rb8 Re1 Qb1#
hayki34,1380,chesscarl,2239,-859,black,resign,78,d4 d5 c4 e6 e3 Nf6 Nc3 Be7 Nf3 O-O Be2 dxc4 Ne5 a6 Bf3 c5 Nxc4 cxd4 Ne2 e5 Qd3 Bb4+ Kf1 Re8 a3 e4 Bxe4 Nxe4 axb4 Nxf2 Qxd4 Nxh1 Qxd8 Rxd8 Nc3 Be6 Na5 b6 Nb7 Rd7 Kg1 Ng3 Nd6 Rxd6 hxg3 Rd3 Kf1 Nd7 Ke2 Ne5 Kf2 Rd7 e4 Nd3+ Kg1 Nxc1 Rxc1 Rd4 Rc2 Rad8 b5 a5 g4 Rd2 Rxd2 Rxd2 Kh2 Rxb2 g5 Rb3 Ne2 a4 Nd4 a3 Nc2 a2 e5 Rb1
dharanidharan,1340,santio,2197,-857,black,resign,72,e4 e5 Nf3 Nc6 Bc4 Be7 Nc3 Nf6 d3 d6 h3 O-O Be3 Na5 Bb3 Nxb3 axb3 a6 Nd5 Re8 Nh2 h6 Qf3 Be6 Nc3 c5 Ng4 Nd7 Qg3 Kh7 Ne2 Rf8 Ra3 Rb8 c4 Bh4 Qf3 f5 exf5 Bxf5 g3 Bxd3 Qg2 Bxe2 Kxe2 Bg5 Bxg5 Qxg5 Qe4+ g6 h4 Qf5 Qxf5 gxf5 Ne3 f4 gxf4 exf4 Nd5 Rbe8+ Kf3 Ne5+ Kg2 f3+ Kg3 Rf7 Kh3 Rg8 Re1 Rg2 Rf1 Ng4
kurtbusch,1508,swarje,2364,-856,black,resign,30,e4 c5 Nf3 d6 d4 cxd4 Nxd4 Nf6 Nc3 a6 Bc4 e6 Bg5 Be7 O-O O-O Re1 b5 Bb3 Qc7 f4 Nc6 Bh4 Nxd4 Qxd4 d5 exd5 Bc5 Qxc5 Qxc5+
shivangithegenius,976,sorethea,1832,-856,black,resign,19,d4 g6 e4 Bg7 Bf4 e6 Bc4 Ne7 Nf3 h6 Ne5 O-O Qg4 d5 exd5 exd5 Bd3 Bxg4 Bxg6
morteza0088996655,1500,yht,2352,-852,white,resign,33,d3 e6 Nc3 Bc5 Nf3 Nf6 d4 Bb4 Bd2 d5 a3 Ba5 e3 Bd7 Bd3 O-O h4 Bxc3 Bxc3 Ne8 Ng5 h6 Nh7 Nf6 Ng5 hxg5 hxg5 Ne4 Bxe4 dxe4 Qh5 f6 g6
trrrrillionaire,1401,jeden94,2252,-851,black,mate,68,Nf3 d5 g3 Nf6 Bg2 c6 O-O Bg4 d3 e6 Nbd2 Nbd7 h3 Bh5 e4 Be7 Qe1 O-O e5 Ne8 h4 Qc7 d4 c5 c3 cxd4 cxd4 Qb6 Nb3 Rc8 Be3 f6 Qd2 Bxf3 Bxf3 fxe5 Rac1 Rxc1 Rxc1 Rxf3 Rc8 Rf8 dxe5 Nxe5 Qc1 Qb4 Nc5 d4 Nxe6 dxe3 Nxf8 exf2+ Kg2 Qe4+ Kh3 Qf5+ Kg2 f1=Q+ Qxf1 Qxc8 Qe1 Qc6+ Kh3 Bxf8 Qxe5 Nf6 h5 Qh1#
kraloyun,951,serse72,1793,-842,black,mate,52,e3 e5 d3 Bb4+ Bd2 Bxd2+ Qxd2 d5 Nc3 Nf6 Nf3 Nc6 Na4 O-O Nc3 Bg4 Ng5 h6 Nh3 Bxh3 gxh3 d4 exd4 exd4 Ne4 Re8 Bg2 Nd5 h4 f5 O-O-O fxe4 Bxe4 Ncb4 f4 Nxa2+ Kb1 Ndc3+ Ka1 Nxd1 Qxd1 Nb4 Bxb7 Rb8 Bc6 Nxc6 c3 dxc3 bxc3 Qd5 Qg4 Qa5#
s_hari,1143,erdugliano71,1984,-841,black,mate,36,e4 c5 Qf3 Nc6 Bc4 e6 Nh3 Ne5 d4 Nxf3+ gxf3 cxd4 Bg5 Be7 Bxe7 Nxe7 Nd2 d5 exd5 Nxd5 Bxd5 Qxd5 O-O-O Qxa2 Nf4 e5 Nd5 Qxd5 c4 dxc3 bxc3 Bf5 Rhe1 Qa2 f4 Qc2#
del157,1160,oggy04,2001,-841,black,mate,56,e4 c5 Nc3 Nc6 Nf3 e6 d4 cxd4 Ne2 Bc5 c3 dxc3 Nxc3 Nge7 Bg5 f6 Bf4 O-O Bd3 b6 e5 fxe5 Nxe5 Rxf4 Nf3 Bb7 Qe2 Rc8 g3 Rxf3 Qxf3 Ne5 Qe2 Bxh1 O-O-O Bf3 Bxh7+ Kxh7 Qxe5 Bxd1 Nxd1 Bd4+ Kd2 Bxe5 Ne3 Bxb2 f4 Qc7 Ke2 Qc1 Nd1 Rc2+ Kd3 Qxd1+ Ke4 Qe2#
radu45,1243,robixy,2082,-839,black,resign,62,e4 c5 c4 Nc6 f4 d6 Nf3 Nf6 d3 g6 h3 Bg7 g4 a6 Qa4 Bd7 Nc3 Nd4 Qd1 Nxf3+ Qxf3 b5 b3 b4 Ne2 Nxe4 Rb1 Nc3 Nxc3 Bxc3+ Bd2 Bg7 Bg2 Rc8 Qb7 a5 O-O O-O f5 Qc7 Qxc7 Rxc7 Rbe1 Re8 Bf4 Ra7 h4 a4 Ra1 axb3 axb3 Rxa1 Rxa1 gxf5 g5 Bxa1 h5 Rc8 Bd5 Bc6 Bxc6 Rxc6
littlecherry1107,1287,rps_1899,2126,-839,black,mate,68,a3 e5 Ra2 d5 b3 Nc6 Bb2 Be6 c3 Nf6 Qc2 Be7 d3 a5 Nd2 O-O e3 b5 Ne2 e4 f3 exd3 Qd1 dxe2 Qxe2 Rb8 Kf2 Ne5 g3 c6 Bg2 Qb6 h3 Ra8 Rh2 b4 a4 bxc3 Bxc3 Bc5 Bb2 d4 Ra3 Bxa3 Bxa3 dxe3+ Qxe3 Qxe3+ Kxe3 Rfd8 Kf2 Rxd2+ Kg1 Bxb3 f4 Nc4 Bf3 Nxa3 g4 Rxh2 h4 Ra2 f5 Rd8 g5 Ne4 Bxe4 Rd1#
mimirilinguis,1026,angel2006,1864,-838,black,mate,84,e3 d5 d4 Nf6 f3 Nc6 Bb5 Bd7 Bxc6 Bxc6 b3 e6 f4 Ne4 a4 Qh4+ Ke2 Ng3+ Kd2 Nxh1 Qe1 Bb4+ c3 Qxe1+ Kxe1 Be7 Ke2 Bh4 Nd2 O-O-O g3 Bxg3 hxg3 Nxg3+ Kf2 Ne4+ Nxe4 dxe4 Bd2 h5 Ne2 h4 Rh1 f6 Ng1 g5 Rh3 g4 Rh2 g3+ Kg2 gxh2 Kxh2 e5 Be1 exf4 exf4 e3 Ne2 Bf3 Ng1 Bd1 Nh3 Bxb3 a5 e2 Nf2 Rde8 Kh3 Re3+ Kg2 h3+ Kh2 Be6 c4 Bxc4 d5 Bxd5 Nd1 exd1=Q Bc3 Rxc3 f5 Qh1#
mastermoise,1357,raesremmurd,2193,-836,black,mate,94,c4 f5 d4 Nf6 Nc3 e6 Nf3 Bb4 e3 Bxc3+ bxc3 c6 c5 Qa5 Qd2 Ne4 Qd3 Qxc3+ Qxc3 Nxc3 Bd2 Nd5 Bc4 O-O Bxd5 exd5 Ne5 Na6 O-O Nc7 Ba5 Ne6 h3 b6 Bb4 a5 Bc3 Ba6 Rfb1 b5 Bxa5 Bb7 Bb6 f4 Nxd7 Rf7 Ne5 Rf5 Rb3 fxe3 fxe3 Raf8 Rbb1 Rf2 Rf1 Re2 Ng4 Ra8 a3 Ra4 Rf2 Rxf2 Nxf2 Rc4 h4 Rc2 a4 Ba6 axb5 Bxb5 Ra8+ Kf7 Ra7+ Kf6 Ng4+ Kg6 Ne5+ Kf5 g4+ Ke4 Re7 Rc1+ Kg2 Rc2+ Kh3 Bf1+ Kg3 Kxe3 Rxe6 Rg2+ Kh3 Kf4 Rxc6 Re2#
yalda,1433,aqwert,2267,-834,black,resign,70,e4 d5 Bd3 dxe4 Bxe4 Nf6 Nc3 Qd6 d3 Nc6 Nf3 Qe6 O-O Nxe4 Nxe4 Qd5 Re1 Bg4 Nc3 Qd8 h3 Bxf3 Qxf3 e6 Bf4 Nd4 Qd1 Bd6 Bxd6 cxd6 Ne4 Rc8 c3 Nf5 Qa4+ Rc6 Qxa7 O-O Qxb7 Rc7 Qb3 d5 Nd2 Qg5 Nf3 Qf6 c4 dxc4 dxc4 Rfc8 Rac1 Nd6 Ne5 Qe7 Qd3 f6 Ng4 Nxc4 Nxf6+ Qxf6 b3 Ne5 Qa6 Rxc1 Rxc1 Rxc1+ Kh2 Qf4+ g3 Nf3+
sphohuchiha,1322,releasethebats,2156,-834,black,mate,52,c4 Nf6 e3 d5 c5 e5 b4 a5 Ba3 axb4 Bxb4 Na6 Ba3 Nxc5 Bxc5 Bxc5 Bb5+ c6 Bd3 e4 Be2 O-O Nc3 Nd7 Bg4 f5 Bh5 Ne5 Na4 Nd3+ Kf1 Bd6 Rb1 Rxa4 Qxa4 Qh4 g3 Qxh5 Qa8 f4 exf4 Bh3+ Nxh3 Qxh3+ Ke2 Rxa8 Rxb7 Qg4+ Kf1 Qf3 Rg1 Qxf2#
vevochi,871,zher0,1701,-830,black,mate,74,e4 c5 Bc4 e6 Nf3 Nf6 O-O d5 Bb5+ Bd7 a4 Nxe4 d3 Nd6 Nc3 d4 Ne2 Nc6 Bg5 Be7 Qd2 a6 Bxc6 Bxc6 Ne5 Bxg5 Qd1 Bd5 c3 f6 Ng4 Nf5 c4 Bc6 b3 O-O b4 cxb4 Rb1 a5 c5 Qd5 f3 Ne3 Qd2 Nxg4 Qe1 Ne3 Rf2 Nc2 Qd1 Bxa4 f4 Bh6 Rb2 b3 c6 bxc6 f5 Ne3 Qd2 Nxg2 fxe6 Bxd2 Nf4 Nxf4 Rfxd2 Qxe6 h4 Qg4+ Kf2 Qg2+ Ke1 Qg1#
dead23,1293,dsom1234,2123,-830,white,mate,89,e4 e5 Nf3 Nc6 Bc4 Bc5 a3 a5 c3 Qe7 d4 exd4 cxd4 Qxe4+ Be3 d5 Nc3 Qg6 Bd3 Qxg2 Rg1 Qh3 Bf1 Qe6 dxc5 Nf6 Rxg7 h6 Qd2 Qf5 Rg3 Be6 Nd4 Qe5 f4 Qh5 f5 Bd7 Nxc6 Bxc6 Bd4 Qh4 O-O-O O-O-O Rh3 Qg5 Qxg5 hxg5 Bxf6 Rxh3 Bxd8 Rxc3+ bxc3 Kxd8 f6 Ke8 Re1+ Kd8 Re7 Be8 Bg2 d4 cxd4 b6 cxb6 cxb6 Kd2 b5 Kc3 g4 Bd5 b4+ axb4 a4 Bxf7 Bxf7 Rxf7 Ke8 Re7+ Kd8 Kb2 g3 hxg3 a3+ Kxa3 Kc8 f7 Kd8 f8=Q#
businessman47,1163,tolia,1985,-822,black,mate,22,e4 e5 Bc4 Nc6 Qf3 f5 Qxf5 Nf6 Nh3 d5 exd5 Bxf5 dxc6 bxc6 Ng5 Nd5 O-O Qxg5 d4 Nf4 dxe5 Qxg2#
taranga,1289,hknight_chess,2108,-819,black,resign,28,e4 e5 Nf3 Nc6 Bb5 a6 Ba4 Nf6 Nc3 Be7 d4 exd4 Nxd4 Nxd4 Qxd4 O-O Nd5 Nxd5 Qxd5 c6 Qd3 Qa5+ Bd2 Qxa4 O-O Bf6 Qc3 Bxc3
taranga,1289,hknight_chess,2108,-819,black,resign,28,e4 e5 Nf3 Nc6 Bb5 a6 Ba4 Nf6 Nc3 Be7 d4 exd4 Nxd4 Nxd4 Qxd4 O-O Nd5 Nxd5 Qxd5 c6 Qd3 Qa5+ Bd2 Qxa4 O-O Bf6 Qc3 Bxc3
taranga,1289,hknight_chess,2108,-819,black,resign,28,e4 e5 Nf3 Nc6 Bb5 a6 Ba4 Nf6 Nc3 Be7 d4 exd4 Nxd4 Nxd4 Qxd4 O-O Nd5 Nxd5 Qxd5 c6 Qd3 Qa5+ Bd2 Qxa4 O-O Bf6 Qc3 Bxc3
taranga,1289,hknight_chess,2108,-819,black,resign,28,e4 e5 Nf3 Nc6 Bb5 a6 Ba4 Nf6 Nc3 Be7 d4 exd4 Nxd4 Nxd4 Qxd4 O-O Nd5 Nxd5 Qxd5 c6 Qd3 Qa5+ Bd2 Qxa4 O-O Bf6 Qc3 Bxc3
dead23,1295,dsom1234,2112,-817,black,resign,28,e4 e5 Nf3 d6 Nc3 Nf6 d4 Nbd7 dxe5 dxe5 Bg5 Bc5 Bc4 c6 O-O b5 Bb3 O-O a4 b4 Na2 a5 c3 Ba6 Re1 Qb6 cxb4 Bxf2+
efeozbakir1,1210,hakanerkam,2026,-816,black,mate,38,d4 d5 Bg5 h6 Bf4 Nf6 e3 Bf5 Bb5+ c6 Ba4 e6 Bxb8 Rxb8 Nf3 Bd6 O-O O-O Kh1 Bg4 g3 Ne4 Nc3 Qf6 Nxe4 dxe4 h3 Bxf3+ Kh2 Bxd1 Raxd1 Qh4 Rg1 f5 Kh1 Qh5 g4 Qxh3#
efeozbakir1,1211,hakanerkam,2025,-814,black,mate,96,d4 Nf6 Nf3 d5 e3 Bf5 Bb5+ c6 Ba4 e6 Ne5 Bd6 Nf3 O-O O-O c5 Bd2 Nc6 Qe1 Bg4 Ba5 Qxa5 Qxa5 Nxa5 h3 Bxf3 gxf3 cxd4 Na3 Bxa3 bxa3 dxe3 fxe3 Nc4 Bb3 Nxe3 Rfe1 d4 Ba4 b5 Bb3 Rac8 a4 bxa4 Bxa4 Nxc2 Bxc2 Rxc2 Rac1 Rfc8 Rxc2 Rxc2 Rb1 h6 Rb8+ Kh7 Rb1 d3 Rd1 d2 Kf1 Rc1 Ke2 Rxd1 Kxd1 Nd5 Kxd2 Kg6 a4 Kf5 Kd3 Kf4 Ke2 Nc3+ Kf2 Nxa4 h4 Nc3 Kg2 a5 Kf1 a4 Ke1 a3 Kd2 a2 Kc1 a1=Q+ Kc2 Ke3 f4 Kd4 f5 Qb1+ Kd2 Qd1#
kylecuver1,999,thebadfish,1810,-811,black,mate,34,e4 f5 f3 Nf6 Bd3 fxe4 fxe4 e6 Nf3 d5 Nd4 dxe4 Bb5+ c6 Bc4 Bd6 Nc3 Nd5 Bxd5 Qh4+ Kf1 exd5 Nf5 O-O g3 Rxf5+ Kg2 Rg5 d3 Bh3+ Kg1 Rxg3+ hxg3 Qxg3#
kylecuver1,999,thebadfish,1810,-811,black,mate,46,e4 c5 d3 Nc6 Nc3 g6 Nf3 Bg7 Bd2 Nf6 g3 d5 Bg2 dxe4 dxe4 Bg4 Qe2 Nd4 Qd1 Qd7 Be3 Rd8 Bxd4 cxd4 Ne2 Nxe4 Nexd4 Bxd4 Nxd4 Bxd1 c3 Nxf2 Kxf2 Ba4 b3 Bc6 Nxc6 bxc6 h4 Qd2+ Kg1 Qe3+ Kf1 Rd2 Rh2 Qf2#
kylecuver1,999,thebadfish,1810,-811,black,mate,48,e4 d5 exd5 c6 dxc6 Nxc6 Nf3 e5 d3 Bg4 Be2 Bc5 Rf1 Nf6 Be3 Bxe3 fxe3 Qb6 Qd2 Qxb2 Na3 Qxa1+ Bd1 e4 dxe4 Nxe4 Qd5 Qc3+ Ke2 O-O Qxe4 Bxf3+ Kxf3 Qxa3 Qd5 Rad8 Qc4 Ne5+ Ke4 Nxc4 Be2 Rfe8+ Kf3 Rxe3+ Kf2 Rxe2+ Kxe2 Qe3#
kylecuver1,1003,thebadfish,1813,-810,draw,draw,65,e4 c5 d3 Nc6 Nf3 d6 Nc3 e6 Be3 Nf6 h3 Be7 g4 h5 Rg1 h4 a3 Bd7 Bg5 Ng8 Bxe7 Qxe7 Qe2 g5 Qe3 f6 d4 cxd4 Nxd4 Nxd4 Qxd4 Bc6 Bb5 Qc7 a4 e5 Bxc6+ Qxc6 Qd2 Ne7 O-O-O Rd8 b3 Rc8 Kb2 a6 Nd5 Nxd5 exd5 Qc5 c4 a5 f3 Ke7 Qc2 Qe3 Qf5 Qf2+ Kc1 Qe3+ Kb2 Qf2+ Kc1 Qe3+ Kb2
supersapien55,1455,doraemon61,2264,-809,black,resign,58,e4 c5 Nc3 Nc6 f4 g6 Nf3 Bg7 Bc4 d6 O-O e6 d3 Nge7 Qe1 h6 Qh4 Nd4 Nxd4 cxd4 Ne2 d5 Bb3 dxe4 dxe4 O-O f5 Qb6 Kh1 g5 Bxg5 hxg5 Qxg5 exf5 Qxe7 Bf6 Qa3 fxe4 Rf4 d3 cxd3 exd3 Ng3 Be5 Rb4 Qh6 Kg1 Qe3+ Kh1 Bxg3 hxg3 Qxg3 Rb1 Kg7 Rf1 Rh8+ Kg1 Qe3+
supersapien55,1455,doraemon61,2264,-809,black,resign,70,d4 Nf6 c4 e6 Nc3 Bb4 Qc2 O-O Nf3 d6 a3 Bxc3+ bxc3 Nc6 e4 e5 d5 Na5 Bg5 h6 Bh4 Bg4 Nd2 g5 Bg3 Bd7 Be2 Bg4 Bxg4 Nxg4 h3 Nf6 O-O Nd7 Rab1 b6 h4 gxh4 Bh2 Qg5 Nf3 Qg4 Nd2 h3 g3 Nc5 f3 Qg5 Kh1 Qe3 Rbe1 Qd3 Qc1 Kh7 f4 Nxc4 Nxc4 Qxc4 fxe5 Qa2 Rg1 Nd3 Qe3 Nf2+ Qxf2 Qxf2 Ref1 Qe2 Re1 Qf3+
supersapien55,1455,doraemon61,2264,-809,black,resign,46,e4 c6 d4 d5 e5 Bf5 Ne2 g6 Ng3 Be6 Bd3 Nh6 Bxh6 Bxh6 O-O O-O f4 Qb6 Ne2 c5 c3 cxd4 cxd4 Nc6 f5 Nxd4 Nxd4 Qxd4+ Kh1 Qxb2 fxe6 Qxa1 exf7+ Rxf7 Rxf7 Kxf7 Qf3+ Kg7 Qxd5 Rc8 g3 Qb2 Bc4 Qxb1+ Kg2 Qc2+
misfox,1097,muddel,1902,-805,black,mate,68,e4 c6 Qh5 Nf6 Qf3 e5 c4 d6 b3 Bg4 Qg3 Be7 f3 Be6 h4 Nh5 Qh2 Nd7 d3 h6 Bd2 Qb6 Be2 O-O-O Nc3 g5 hxg5 hxg5 Nd1 Bf6 Nb2 Nf4 Nh3 Nxh3 gxh3 Rxh3 Qg2 Rdh8 Rxh3 Rxh3 O-O-O Nc5 b4 Nd7 a3 d5 exd5 cxd5 cxd5 Bf5 Nc4 Qc7 Kb1 Kb8 Bxg5 Bxg5 Qxg5 Rh2 Qxf5 Rxe2 Qxf7 b5 d6 Qc8 Na5 Qc2+ Ka1 Qb2#
crazyscientist2,1500,unicornz,2305,-805,black,mate,122,e4 c5 Nc3 d6 f4 g6 Nf3 Bg7 Bc4 Nc6 d3 Nf6 O-O O-O Qe1 Nd4 Nxd4 cxd4 Ne2 d5 exd5 Nxd5 Qg3 Bf5 Qf2 Nb4 Ng3 e6 Nxf5 exf5 a3 Nc6 Bb5 Rc8 Bd2 a6 Bc4 b5 Ba2 Ne7 Bb4 Re8 Rae1 Qd7 Re2 Nd5 Rfe1 Rxe2 Rxe2 Nxb4 axb4 Qd6 Qe1 Rf8 Re8 Qxf4 Bb3 h5 g3 Qd6 Qe2 Kh7 Rxf8 Qxf8 Qf3 Qxb4 Qd5 Qe1+ Kg2 Qe2+ Kh3 Qg4+ Kg2 h4 Qf3 Qxf3+ Kxf3 hxg3 hxg3 Kg8 Kf4 Kf8 Bd5 Ke7 Bb7 a5 Ba6 b4 Bc4 f6 Kf3 Bh6 b3 Bd2 g4 fxg4+ Kxg4 f5+ Kf3 Kf6 Ke2 Bc1 Kf3 g5 Bd5 g4+ Kg3 Kg5 Be6 f4+ Kg2 f3+ Kf2 Kf4 Bf7 Be3+ Kf1 g3 Bh5 g2+ Ke1 g1=Q#
crazyscientist1,1500,unicornz,2305,-805,draw,draw,66,e4 e5 f4 d5 exd5 exf4 Qf3 Nf6 Nc3 Bd6 Bb5+ Nbd7 Nge2 O-O d4 g5 h4 g4 Qf2 Nb6 Bxf4 Nbxd5 Bxd6 Qxd6 Nxd5 Nxd5 O-O f5 Bc4 c6 Nf4 Be6 Nxd5 Bxd5 Bxd5+ Qxd5 Qf4 Rf7 Qg5+ Kh8 c3 Rg8 Qf4 Re8 Rae1 Rxe1 Rxe1 Qd8 Qe5+ Qf6 Qxf6+ Rxf6 Re7 g3 Kf1 f4 Rxb7 Rh6 Rxa7 Rxh4 Ke2 Rh1 a3 Rc1 Kd2 Rf1
austindecoder,838,walledmisk,1642,-804,black,resign,44,e3 e6 d3 g6 h4 Bg7 a4 Nf6 Ra3 O-O Rhh3 b6 Rab3 Nc6 Rhg3 Na5 Rbc3 Nh5 b4 Bxc3+ Ke2 Bxb4 c3 Nxg3+ Ke1 Qxh4 Kd2 Nf5 Na3 Qxf2+ Qe2 Bxc3+ Kxc3 Qxg1 Qf2 Qxf2 Nc4 Nxc4 Ba3 Nxa3 Kb3 Nc2 Kc3 Ncxe3
crazyscientist1,1015,bz,1818,-803,white,mate,115,e4 c5 Nc3 e6 f4 a6 a4 b6 Bc4 Bb7 d3 Nc6 Nf3 Qc7 O-O Nge7 Qe1 d6 Qg3 Ng6 h3 Be7 f5 exf5 exf5 Nge5 Qxg7 Rf8 Qxh7 Nxc4 dxc4 Nb4 Nd5 Bxd5 cxd5 Bf6 Bg5 Rh8 Rfe1+ Kd7 Qxf7+ Kc8 Qxc7+ Kxc7 Bxf6 Rhf8 Bg7 Rxf5 Re7+ Kd8 Rae1 Nxd5 Re8+ Kd7 Rxa8 Nb4 Ra7+ Kc6 c3 Nd3 Ree7 Nxb2 Rac7+ Kd5 Rf7 Rxf7 Rxf7 Nxa4 Rf5+ Kc4 Rf4+ Kb5 Nd2 d5 Rf5 Kc6 Rf6+ Kd7 Rf7+ Ke6 Ra7 a5 Nb3 Kf5 Nxa5 bxa5 Rxa5 d4 cxd4 Ke4 Rxa4 cxd4 Rxd4+ Kf5 Kf2 Kg6 Kf3 Kxg7 Kf4 Kg6 Rd5 Kh6 Rg5 Kh7 Kf5 Kh6 Kf6 Kh7 Rg6 Kh8 Kf7 Kh7 Re6 Kh8 Rh6#
